flair,title,score,id,url,comms_num,body,author,comments,timestamp
Scheduled,TIFU by being from a Scheduled Caste but apparently not looking like one,342,7jhqsa,https://www.reddit.com/r/india/comments/7jhqsa/tifu_by_being_from_a_scheduled_caste_but/,264,"Sorry for the dramatic title. Also as TIFUs usually go, this did not happen today but over a period of a month

A little background, I'm a 27 year old male, IIM passout. working in a well known consulting firm earning about 30LPA. I am a sincere, hardworking, simple dude. Since most caste related discussions always end up about reservation, lemme clarify that I never used it. Got 99.4 %ile in CAT, also had got AIR in 600's general in IITJEE. But here's the catch, despite being a Telugu SC, apparently I don't look like one. I am light-skinned and have good facial features I guess.

So I figured I was ready to get married. Since I had no luck on Tinder and was extremely busy to go out and find someone, I created a profile on one of those matrimony websites for professionals because I want an educated, broad-minded working wife. MISTAKE #1. Most of the profiles on there were of girls from highly educated backgrounds and thats the reason I thought I could find someone like me whom I could connect with in terms of principles, attitude toward education/work/life, my agnostic beliefs etc.

I checked the 'Any' option on caste as it doesn't matter to me and figured since this is a place for educated professionals, nobody really cares about caste. MISTAKE #2.

So within a week, I get a fair amount of matches. Some are handled by parents, some handled by the girls themselves. Here are some interesting experiences I had over a period of a month:

1) **Telugu Unkil**: Caste mentioned - Kapu. Says he is ""highly interested"" in my profile. I mail him back saying if he has any caste preferences and that I prefer open-minded people in general. Writes back saying how his daughter is very broad-minded, hates traditional mindset and they are looking for a very liberal family. I think great, I would like to know more about her and we started talking on whatsapp and we seem to hit it off pretty well. 5 days later she asks me my caste and I mention it. Ghosted. No replies, she unfriends me on facebook, blocks me on whatsapp. I move on.


2) **Gril**: Works for a big bank in Mumbai. Mentions 'Any' caste. So I think great. I message her and she accepts it. We exchange numbers and start talking. A week goes by, we have talked about our jobs, future plans, location preferences and want to schedule a personal meetup. She messages me - ""hey I think you should know this, I am from Teli caste which is OBC. Hope your parents are ok?"" I tell her I don't care and neither do my parents. Then I tell her about my caste, and she starts acting weird. Starts replying to my texts in syllables and tries to hang up on my calls. I feel bad and message her asking what ticked her off. She says that she thought I was from an upper caste and that's why she replied to my message. And now she doesn't want to proceed any further and want to cancel all further plans. I told her that it's a bit hypocritical of her that initially she was one wanting my parents to be ok with her being OBC when she thought I was from OC. 


3) **Marathi Auntie**: This one's a bit hilarious. She sends me a message saying she really liked my profile for her daughter. I look it up and sure enough - mentioned 'any caste'. I give her my number and she sends me a complete biodata about her daughter. Daughter is really pretty and from MDI Gurgaon, I think great. But she mentions caste as 'Rigvedi Brahmin'. I think oh f**k. I send her all the details, mention my caste and even bracket it with '(SC)'. Immediately she goes, ""I really like your profile. Tell me the next steps or give me your parents number"". I'm like - this can't be happening. Then it hits me that maybe she has glanced over the caste part in her hurry. So I send another text saying,- ""ma'am pls confirm that you have seen my caste, and it falls under Scheduled Caste"". Never heard back from her.


There are a few more like this. Most of the profiles message me about my caste and go silent when I mention it. I realized that all my life, my circle of friends have ranged from all castes, religions and financial backgrounds and they never made me feel like a dalit or whatever. I have lived a happy and fairly successful life. That was the reason I was ignoring the caste aspect for finding someone to spend my life. 

Now I have learnt my lesson and changed my caste to clearly say SC and will stick to my own I guess. I also feel like giving up on these matrimony websites. It's been a great learning experience about my position in the society folks! :)",whiteobsidian," You’re actually saving yourself from getting into a family of hypocrites. Not really a fuck up.

Good luck! I thought caste no longer existed in cities /s

Funny how the OBC girl was open-minded... for the castes above her.  OP, just invite me to your wedding, that's all I care about.

PS: I'm from okayish caste, not too high, not too low. Any caste generally means that they are okay with people of higher caste contacting them.  So ""open minded"" is my caste plus caste considered above mine. Matrimonial sites are hilarious and sad. 

just a thought, you are still 27 why hurry?  There was a gilded comment by a black guy a few days ago that said that he really appreciated when the bullets dogdged him for a change.  This is the same.  Unfortunately Indian matrimonial sites is just online aunty network without the aunties. There will be the same BS except it's online. 

Take some time out and start dating. In the grand scheme of things, finding the right person is as important as JEE. * **Any caste** means **any equal or higher caste**

Educated ""modern"" broad-minded Indian _hypocrites_.

OP, you dodged a bullet with every one of those.

Marry a girl who, as they say, ""loves you at your worst"". You are lucky you got matches. My friend (bengali upper caste) from IIM didn't get any matches when he didn't mention caste in his matrimonial profile 5 years ago. This is what modern day un-touchability looks like >  IIM passout

> working in a well known consulting firm 

>earning about 30LPA

> sincere, hardworking, simple dude

>Got 99.4 %ile in CAT

> AIR in 600's general in IITJEE

>Telugu 

*stops reading* IIM does not teach you that Indians are hypocrites of the first order? SC guy here, top educational institution and worked for top companies but not an IIT/IIM guy.

When I got married, the first line of my profile was I am an SC, dont believe in Reservation that benefits only the creamy layer. Rest of the stuff, I was very transparent about what I was looking for - a no-nonsense girl who is non-hypocrite, non pretentious humanist. Caste/religion no bar.

Got fair number of interests from inside and outside my caste. It was hard to see people with matching academic background from an SC caste. The non-SC interests I received were mostly from other religions.

Married to a no-nonsense unpretentious smart girl, her parents are from a brahman + other religion mix. A couple of my close friends who married within their caste have said they wished their married life was as stable as mine, after interacting with my wife and me for a while.

Hang on dude. Fuck this shit. I'm so tired of people acting all ""modern"" on the outside and being a casteist, hater on the inside. This is just ridiculous. 

Dude hugs man. I mean what can I say, just know that if someone asks you your caste they're not worth your time.  [removed] [deleted] [deleted] Lesson no 1. Those who developed a thinking that girls are some magical creatures and are very innocent and caring should know that they are human and just like men are in general shitty. Also given the chance they can act even worse than men and they do.

Lesson no 2. जात कुछ जाती नही

Caste never goes away.

Women at the time of arranged marriage will prefer someone from their caste only no matter how ""open minded,Liberal or progressive they claim to be""

The reason for this? All those lables are to fit in socially and nothing else.

Lesson no 3. Everyone's hypocritical. Some will admit maximum won't. That doesn't change the fact.  Shaadi ka laddu  ouch. some people just suck, OP.  This is just sad.

As much as I hate to say this, you should mention your caste on matrimony sites cos ppl do judge you based on caste and this unfortunately is the reality of India. Better to keep the hypocrites at bay. 

My parents had an inter-caste marriage. That being said, it is a fact there are differences in upbringing (type of food, type of interests etc.) and general attitude/mentality of people ( pet peeves, biases, dinner convos etc.) of families belonging to different castes. This isnt that big a deal if the couple plans to stay away from parents and love each other enough to get over the differences in mentality. But these differences cause a lot of issues when the couple decides to stay with either set of parents. Especially for the wife. I know my mom suffered a bit in her early days since she is from a lower caste compared to my dad, similar thing happened with one of my aunts. My dad stood by my mom and both of them were working and earning so things worked out eventually, my aunt ended up divorcing my uncle.

An upper caste friend of mine married an SC guy and her parents all but abandoned her, her husband's parents were somewhat accepting but issues did creep in over the years and now the couple are staying in a different city.

My advice would be to find a girl who is willing to relocate and not overly attached to parents/family or someone who has stayed abroad or has had a parent who has worked/stayed abroad. In those scenarios the caste issue will likely get diluted Whoa, from Tinder directly to a matrimony website? [deleted] You are being honest in India, mate. Won't work unless she is 1 in a million, who literally doesn't care. 

Ride solo instead. 🤘 i don't know if its true for most grills , but All of the grills i know never married below their so called ""caste strata"", but i know many guys who have relationships/marriages without a fuss about this. All the best OP, you will find a wonderful bride. Till then collect stories to publish a nice entertaining book. it shouldnt be TIFU but the others who f****** up by rejecting you based solely on caste. Good for you... I suggest leave this AM madness and look for someone who actually likes you!  So even a guy earning 30 lpa with IIT-IIM tag can't get over his caste when it comes to marriage 

Why are you not marrying within your community though ??  Damn! That is really sad to read. This must be really hurting for you.
I am SC too and nowhere near OP's financial and education status. I guess, I should start worry about marriage now. 

 I don't get the fuss around castes. I don't know the caste of my ex, I don't know the castes of my best friends, and I couldn't even be bothered to ask. It's an irrelevant label given to people that people don't even get to choose! Telugu people are casteist AF, no ? even here on randia caste feelings about marraige are pretty strong, people got triggered when sometime back i had suggested (after ambedkar) that people should marry outside their caste for eradicating caste system. but seems that caste runs too deeply in the indian psyche Wow i never knew caste is such a huge issue even in urban  areas. I know for a fact that I'm OBC (because 10th board forms. Never knew what my caste is), but I never knew what my exact caste is, since we never used the reservation. 
This discrimination is just saddening. Thank God I'm gay! >Got 99.4 %ile in CAT, also had got AIR in 600's general in IITJEE.

Go to Europe. Get cool job. Get white girl. They don't know what SC is. why not post this on /r/tifu thread? i mean a lot of foreigners comming here to experience religion should know what they are buying into. What you're facing is ""did not read the instructions carefully"". Indian people don't read instructions on a hazardous item also. Let alone a marriage profile.

And like others have said -- (though you are wasting time), you are saving yourself from hypocrites. This is sick. I hope you find someone good yourself than through this arranged marriage business. Good luck. Such is reality. But keep an open mind and don't give up and weeding out the assholes is easier at this phase than at a later stage -from a person in a similar situation as you Wow ! Great(?) experience, keep track of your experiences till you meet your wife and write a book. One day it can become a movie ! :) This is the saddest thing I have read today. What the fuck people.  Caste is well alive even in urban India. No matter what you get or achieve in your life, you will be always judged by your caste and color. Nothing can change this mentality. I think it happens for your good, can you imagine marry such narrow-minded girl? You saved yourself bro. keep trying on tinder! Lol see the down votes. 
Good Luck OP but I think 27 is too early to get married. Haha this is so funny and so fucked up. ""Incredible india"" This is so sad and disturbing if narrated events are True. I can understand if less educated villagers are caste conscious but highly educated professionals from Metro have such mindset? Shocked and appalled. Perhaps, I was mistaken that people get enlightened with education. [deleted] caste system can't be broken by sustaining the system. you have anyway rejected the reservations that you were provided, for which i respect you. so, i don't see why you should still be hanging onto a demeaning label that somebody else gave your ancestors. just make up a caste of your own and don't call yourself an SC. as far as i know, there is no law preventing you from creating a caste of your own. My best friend a SC is dating a Brahmin. I remember her mother found out and she told her he will never marry you, no higher casts would accept a SC daughter-in-law. Her mother was right. My friend is the daughter to two civil servants. Still this is the status quo.  So no one is talking about 30LPA. OP sorry for your condition, but being a dick that I m, would like sharing your CAT prep strategy.

Obligatory caste notification, Dont know the caste but I m a fucking Tribal  from Bihar and do look like one.

EDIT : Also do invite me to your wedding if you dont mind a tribal in your wedding If you don't mind me asking kaun jaat ho? I mean which caste?

Why I am asking is because most northies including Maharatrians won't know the Telugu caste hierarchy unless you tell them. 

So you can either say bluntly that you are SC or you can tell them in a softer fashion that your caste is classified as SC but it isn't comparable to northie hierarchy and also highlight your own achievements. I mean soften the blow.

Now I am going to  be criticised for what I said above as it's playing the caste game and not taking the high road. However caste is a reality. Also you have chosen arranged marriage route so you can't escape it. Also your own post starts with claming you aren't stereotyptocal SC and you want to play up that card.  Soceital attitudes that makes one cringe. Racism (Skin-color), casteism, or communalism (religion) - these attitudes are programmed into us by an earlier generation , consciously or unconsciously. Its our choice if we want to *work at* eliminating them from our psyche - these are like layers of an onion - impossible to cast off in one go.  

Being in contact with diverse people can of course speed up the unlearning. You're fucking better off bro. You're killing it professionally (and you can only go up from here) and you're obviously intelligent and well educated. I'm not saying this to lift your spirits or whatever, you don't need that shit. What I'm saying is, if these people want to cling to archaic bullshit, let them. They may think you're beneath them but they're wrong. You outclass them by far. You do you bruh. I will die alone someday because I am of lower caste too minus the IIM pass out and fat paycheck stuff.

I once passed out in front of a college so I guess that counts :D Dude, what do you expect in India? It's uniformly hypocritical. Live and learn, I guess. **becuase there is a caste system , there's so much of reservation** 
Now , why do you want to curb down the 49% that the general category has ? 
I'm against the part where they allow them to take a general seat . 
I know reservation can't be eliminated fully , atleast not in the near future  Matrimonial sites are cancer. Avoid them at all costs. It's better to get fixed by relatives. Maybe I don't really understand the issues of the SC/ST but why would you actively identify with something that has kept you and your people down for so long? You could have just said you were buddhist and have lived without a caste for the last 3 generations.

You could have been happily married by now OP but instead you would rather everyone know that you're part of a victimized subjugated interest group. > I figured I was ready to get married.

How ya figure that? long time no sex? I wanna know coz me 26.  You have worked hard for everything in life, work a little bit more for that SO, who accepts everything from you.  Teli? Isn't that Jewish? You got jebaited.... :/ Bullet dodged like Neo from the Matrix, OP! Congrats and good luck in your spouse-hunt! As far as my experience goes - Even girls who are 'liberal' (  fuck around) mostly end up with with guys from their own caste only  Arranged marriage is a fucked up process, OP. If it is any consolation, I'm from an upper caste and I explicitly mentioned that I don't give a fuck about caste on my matrimonial profile only to face rejection from both upper and lower castes. 
I was dumped by my gf of 2 years the moment her parents found out I'm a different caste and went on to emotionally blackmail her. Mind you, her caste is lower than mine. She even had this super liberal JNU feminist personality facade about her. Imagine my heartbreak when she jumped on the first opportunity to get hitched to an UPSC job guy her parents introduced to her. Her parents' main objection? My caste. IIM is one caste i like. haha. Can i send my matrimonial page link for you to check? Let meknow [deleted] You said you never used reservation. Here's a take on why people don't : when you're eligible in the general category too , you use  the 'general' seat so that a seat in reservation remains empty , so someone else who got a lower rank can get that benefit. That's how general seats get eaten up. That's not something to be proud of , actually !  > lemme clarify that I never used it. Got 99.4 %ile in CAT, also had got AIR in 600's general in IITJEE

For non reserved candidates, that just makes it worse... putting salt on a wound. >AIR in 600's general


So you chose not to pick a better course at a better IIT using your quota? If you didn't, you're stupid. If you did, you did actually make use of the reservations benefits


There's no need to be this smug and patronizing. Marriages are social contracts, it involves adapting yourself to your spouse's family/culture in varying degrees. If someone's not fond of a certain group of people, ofcourse theyre not going to marry into that caste. 

Also, different castes have different track records with status of women. So if an upper caste woman refuses to marry a guy from a largely illiterate lower caste, it is very much understandable since chances are very high her freedom is going to be severely curtailed. Did you find any girls who were fine with your caste but felt family wont approve? Did you suggest any to try to discuss about your caste with their family?  Which IIM ? When did you pass out? Where do you work now? 
Edit: why the hate? Just want to make friends Why the fuck would someone WANT to marry below his or her social strata if given the choice?",2017-12-13 15:46:03
