flair,title,score,id,url,comms_num,body,author,comments,timestamp
Without the aura of Narendra Modi how successful would have been the lockdown I heard he wasn’t a good PM, but at least he was smart/educated. Man had THREE degrees Thank God, it's you who is missing Singh. My first reaction to reading the headline was, ""what, did that old man went missing under lockdown."" We don't know what he would have done in his pandemic response. So to compare both the PMs is just wishful thinking. [removed] For a few years now, mood of the nation has been ""pehle Hindu ko bachana hai, baaki sab baad me"" Current government is shit. Last one wasn't much better either. Manmohan was a great finance minister. He had no job in running the country. He was a Sonia puppet for the most part and the government was involved in major scams. There wasn't much anti-islam rhetoric but apart from that nothing would have changed here. 

Heck, like him or hate him, I feel Modi at least had the clout where people listen to him which is important if you want to ask them to stay at home for a month. Manmohan was mocked and hardly even felt like a leader who had control over the people. Apart from the theatrics, lockdown is the only solution. Nothing would have changed here OP is feeling *Missing* with Dr. Manmohan Singh  and 50 others. Exactly. > . Singh, history will indeed judge you kindly

But will it be kind to the rest of the country? me too. Manmohan Singh was great. Everyone else around him wasn't. He was just the right man inthe wrong party. l o l लमाओ Today mudiji had to call him ! Karan Thapar,what a journalist. This is how interviews  should.be done.",2020-04-05 16:01:57
Politics,"""Proud Of You"": Pakistan Air Traffic Controller To Air India's COVID-19 Relief Flights",53,fuxjy1,https://www.ndtv.com/india-news/coronavirus-india-proud-of-you-pakistan-air-traffic-controller-to-air-indias-covid-19-relief-flights-2206217?pfrom=home-bigstory,15,,xzygnos," Disagreeing on politics doesn't mean we have to lose out humanity. Pakistan and India will never agree politically but that doesn't mean we only care about politics. This is an interesting observation in recent times. I have seen so many Pakistani people praising India and giving credit to it where due publicly on Facebook pages and real life.

But in India, you cannot do that for Pakistan. Praise something good about Pakistan, and you are a traitor immediately. Saving one life is like saving all of humanity This is not newsworthy, just like writing one article everytime some homeless guy in pakistan burps the word india is irrelevant. 

Good for the guy but there's no need to have an orgasm everytime someone there says a positive thing about india.",2020-04-05 01:24:23
Politics,"It's Friday, 13th. BSE opens with a loss of 3000 points.",218,fhtsl8,https://i.redd.it/g46ms0t27dm41.jpg,40,,gotmyvitamins," Lol, from 10% down to 1% up. Hot dang. From 3k down to 1k up. Shows once again that stock market is nothing but a gamble based on perception and speculation. 

Nothing changed fundamentally for the market to go up. Did all the reasons which were given for crash cease to exist in a couple of hours? It's 32k now Seize the means of production guys. Yikes There is much more than meet the eye. A lot of this fluctuation was operator's game. Nothing has substantially changed to bring the market up 11% unless it was made to fall for no reasons. Well, friday is always the selling day. blood bath.well it's just beginning of the domino effect. This is what happens when you put profits before people. Imagine if the world gave a shit about healthcare for all and governments put people before stocks. Instead we have the stock market tumbling like a scaredy cat at the first sign of trouble. DJIA doing somewhat the same thing. When I went to sleep, premarkets were down ~500 points, woke up and that shit is up 1100 points. many people are advising to buy shares , later it will give 7x profits..

is there any truth in this. Nifty is already at 2014 levels. Yeh hai 6 year ka vikaas.


What I meant-

Coronavirus alone wouldn't have such an impact. And if it is then you should Imagine how powerful China is.


Moreover we have failing banks, Demonstration, poor implemtation of GST, TELECOM, AVIATION sector in turmoil, Manufacturing is all time low.



But hey politics has nothing to do with it.",2020-03-13 12:07:02
Politics,"Bharatiya Janata Party:Strongly condemn violence on JNU campus.This is desperate attempt by forces of anarchy,who are determined to use students as cannon fodder,create unrest to shore up their shrinking political footprint. Universities should remain places of learning&education",65,ekfvvh,https://twitter.com/ANI/status/1213872183006486529,46,,deadbroccoli," I strongly condemn 9/11 - bin Laden The nerve. /r/SelfAwarewolves > This is desperate attempt by forces of anarchy,who are determined to use students as cannon fodder,create unrest to shore up their shrinking political footprint. 

Khud ke baare mein aisa sochte hai? Self-awareness ho gaya inko?

Boo, you whore. Why are they attacking students? This is just unacceptable. Desh ke ye BJP gaddaro ko, satte ke gaddi se laat maarke bhagaao saalo ko. I feel they're going to ban all student politics, suppress every protest from now on History will not forgive Modi Shah Yeah....the whole nation knows whose political footprint is shrinking....are these terrorists admitting to it or they that dumb. Tatti kha bhenchod They really think we are this dumb? This is the second straight fail after call netflix-and-Priya. We really have psychopaths with dementia running this country. *Are maine kaha hypocrisy ki bhi koi had hoti hai* Is Daur E Siyasath Ka Itna Sa Fasana Hai,
Basti bhi Jalani hai Matam bhi Manana hai..

Pinched off FB but sums it completely Ab to sach bol de bosedk! Fuck you assholes. You've only brought misery and trouble to whatever was left of good old India. How do you know it was BJP controlled. Please note I am not trolling anybody and am seriously curious. Please share any reliable links of who the goons were.",2020-01-06 01:20:22
Politics,Gujarat Model Reaches Delhi,1557,f9lw3t,https://i.redd.it/w17lnwm5h6j41.jpg,173,,albertroyishere," I read the whole Rudraksh Mala  article. It's continued on another page.

>""I said Brahmin hoon"", and showed them my Rudraksh Mala I wear. They did stop beating us up because they said ""You are from our own community. You should not be doing this. You should not be filming. We were allowed to go after the videos on the phones were deleted""

Imagine thinking that instead of not doing something that will put the community in a bad light, the solution is to make sure nobody can actually report the incident If anyone observed, in recent election, North East Delhi was BJP's fort. 6 MLA from this area only. That's the same place which burns now. The violence is orchestrated by the ruling political party. Now, they will use this excuse to apply more force to crush the protests. Waah modi ji waah Brilliant headline! ""Delhi is at peace, nothing is happening in Delhi right now."", this would be what PM would be telling Donald Trump during his visit to India. Kaka has finally kept his real election promise. Kajriwal has requested the HM for Army. Should've called for Army earlier. These dumb fucks don't give a shit, not pointing finger at one side. I am speaking for both groups. Real dumb fucks. *Everything Is Fine In INDIA* [removed] Is this for real?! Wow The only newspaper which speaks boldly Modi changasi desh nangasi. A take on Modi’s “sab changa si” statement in us when he attended howdy modi... 2002 ===> 2020 Expecting bhakts to point out the reporters have non-Hindu names. bad for India as whole ... It will effect all the Indian ... irrespective of caste , color , religion or language .... The Hindu and Muslim divide is on high time.... Thank to twitter and facebook  + ignorance .... Very sad state in delhi, I was in since 1983 till 2010, barring 1984 incident which lasted 24 hrs  hour, things were made normal immediately, rest I have never observed any communal disharmony. 
But, what I am observing since beginning of Delhi assembly election, is of unique style. One can easily understand what is happening today, it seems,  it’s script was written in the beginning of January itself. In real sense it is Gujarat Model or Ramlila model of Rawan, if he could not participate in Sita’s swaymber he stole Sita..... it is shameful on the part of government Shocking what hideous crimes the BJP and saffron goons are capable of World is loving in 2020 and we are living in 1947 they claim that stone pelting has stopped in kashmir because of their policies. now delhi has become the new kashmir ""HiNdU kAtRe mE hAiN"" And Kejriwal is eating popcorn and chanting Hanuman chalisa on the stands. Why is kejriwal not doing anything ? UP Model is the best [removed] Sad, we are focusing on wrong things Again one sided analysis. Other side is no saint. Why always victimisation of one side and portraying other side as a demon. As a media, you are supposed to provide objective information. This sub will eat this up because of their inherent bias. Again I am not supporting any one here but it is frustrating. Just think, why would BJP ignite riots now? After elections? When US President is visiting? Have some balance of thought for crying out loud. 24th February it was all a one sided Muslim show, burning, committing arson, stoning, killing cops. It is on 25th when ***retaliation*** started. Now its all about how evil Hindoos killing innocent Muslims. Fuck objectivity, really. How to get attention 101. [deleted] Those condemning the use of 'tukde tukde gang' sound refrain from using 'Gujarat model' in their arguments to avoid looking like a hypocrite. Both the phrases are equally condemnable and should not be celebrated. [removed] kejriwal government  2.0... it is just beginning..",2020-02-26 10:18:45
Politics,I've never been so angry and frustrated with the Government.,247,fq0ui4,https://www.reddit.com/r/india/comments/fq0ui4/ive_never_been_so_angry_and_frustrated_with_the/,135,"While the privileged are sitting at homes, doing pointless shit like posting challenges on Instagram, There are literally millions of daily wage workers, homeless and deprived people. More than 1 lakh people are stranded at the UP Delhi border. Who the fuck will look after them if they contract the disease? Who the fuck will care about them? 

These people are at many times the only breadwinners of the family. Can we be so ignorant, that we readily allow entire families of poor to get destroyed? Some  owners of factories, contractors have simply haven't paid these workers and simply turned a blind eye towards these people. 

People like you and me have plenty of surplus money and resources. There are people who literally completely depend on their next month's salary to run their houses. How do you think would they manage?

Government just abruptly closed down the entire nation. What arrangement did it make so that the poor reach their homes along with their familes safely? It is not as simple as booking a cab or renting a car for them. People are literally walking miles and miles to reach home. Why aren't these people being given masks, being scanned or being disinfected? People are being brutally tortured by the police. Don't they deserve spending this dark and difficult time with their familes, in their homes?
Try to imagine the immense fear and desperation and the helplessness of these people.

Everybody is praising the Indian government on how efficiently they brought an early lockdown. They don't realize what the poor are going through, simply because the society doesn't care about them. 

Please think  again, if you think my thoughts have political origin.",amanagarwalx," I absolutely see the need for this lockdown. If we don't, this disease will spread unchecked and kill _a lot_ of people, mostly these poor guys who are already malnourished and living in horrid conditions.  

_But_ the government should have first implemented a system where there are daily or weekly food deliveries to the poor. We can't let them just starve. Additionally they should have implemented a freeze on rent payments or a government subsidy for those landlords so the poor aren't burdened with it. Food, water and shelter should have first been guaranteed by the government _before_ the lockdown. 

As for allowing them to go home before the lockdown, that is not at all wise. Because of the inadequate testing done by the government we don't know the extent of the spread within cities. We're fairly confident the spread is limited in rural areas though but even that isnt 100% certain, because again, we're not testing nearly as much as we should. 

But allowing mass migration of millions of people from urban to rural is a good way to make sure this virus spreads rapidly among India's impoverished rural population. And mark you, the healthcare infrastructure in rural India is woefully inadequate. We're already going to struggle with the overstretched healthcare facilities in cities. Rural India isn't even close to being prepared for this. Look at how it's ravaging Italy and the US. Imagine the damage it will do here where our healthcare facilities are inadequate in the best of times, where we have high population density, poverty and malnourishment. 

This isn't just a pandemic anymore it's atleast two disasters rolled into one. We're going to see massive unemployment, we're going to see a lot of businesses, big and small, failing. We're going to see a global economic depression not seen since 1929 and maybe even worse than that. And if this disease gets _really_ bad we're going to start seeing a breakdown of our food production and distribution because the poor that grow our food will be sick or dying in droves. Which means, in India alone, millions of deaths from famine, food riots in cities and a possible breakdown of law and order. Of course, this is a worst case scenario and hopefully things won't get so bad but preventing that means we need to take this virus _very seriously_. 

So if the government is finally taking extreme measures to slow the spread then yeah I support it. I don't support the fact they did not account for the well being of the poor before doing this, which they should have. But this lockdown...it's necessary. 

Look, If we're looking at this realistically, there is no 'flattening the curve' for India. The window for that has passed. Cases will spike and it will overwhelm our healthcare system. People are going to die because there won't be enough ICU beds or enough ventilators. The only thing this lockdown will achieve in my opinion is that it will delay that spike, buying the government crucial time to acquire or manufacture more PPE, ventilators and beds. At the very least they can try to raise the bar on the capacity of our healthcare infrastructure so that fewer people die. The government should have started preparing two months ago, we should have converted factories to manufacture PPE and ventilators back then. But like most governments the world over, they were slow to react. And the price for that early inaction is we go into lockdown now. The choice is being in lockdown now or having thousands more preventable deaths later. Neither are good choices but no one has the luxury of good choices anymore in a global disaster of this magnitude. That's the reality the world over and we need to adapt to this because if we don't _people will die_. 

Guys, we are in uncharted waters here. Every country on this planet will have to take _extreme_ measures to prevent massive loss of life. This is the defining disaster of our time. Even the 1918 pandemic or the world wars did not shut down the world like this has. We do not have history to learn from because this has _never happened before_. I've come back home after a fairly long time and have duly switched my parents' evening diet from Tez to NDTV. So now in have two senior citizens who're as heartbroken as I am from 9 to 10.

Ravish's primetime makes your stomach churn. Hard to believe such things happen in India while we bury are heads in the sand like ostriches. people who just a few months ago were ready to take in refugees from other countries cant even take care of their own citizens, where are all those I Support CAA people now? This mass exodus of migrant workers is what happens when a government is myopic to the point of blindness. A proper plan could and would have prevented this. A proper stimulus package planned in advance, and not one quickly put together in reaction to this, should have been there. This mass exodus has many, many, many problems surrounding it. For one, can you imagine people turning into nomads overnight when food and water that's usually available everywhere is missing thanks to a lockdown? Can you imagine, how these men, women, and children are supposed to *walk* hundreds of kilometers in absence of public transport? It's beyond cruel what the Centre has compelled these already oppressed groups of people to do right now. These migrant workers will also (many already are) face the brutality of lathi-happy cops. With state borders locked, they will essentially remain nomads, unless proper arrangements are made for them.  And, worst of all, these migrant workers, who don't have the luxury to wash hands for twenty seconds with soaps (can't afford soaps, can't afford to waste what little water they have), how are they supposed to remain safe from the pandemic? It's also equally likely that they make take the coronavirus along with them to their villages. And let's not forget that rural public healthcare is already in shambles. Those rushing to fellate the prime minister for his ""brave"" and ""strong"" step do not fucking understand how this lockdown has already disrupted the lives of hundreds of thousands of people. [source](https://twitter.com/BucketheadCase/status/1243227045783425024) It’s very heartbreaking , we shouldn’t have even let me be so vulnerable and live pay check to pay check for one meal in the first place Although it's very difficult for the government to *plan it all out* in a ""quick"" decision like what they took, but, they could have been more proactive in addressing the challenges coming out from it. 

YES lockdown was and is the need of the hour, but not at the cost of poor management, which by the way is not all about pre planning. [deleted] #21daychallenge Cant agree more Also with aadhaar details, these migrant workers can be easily helped by the government, But they use our identity only for snooping never ever think of helping the needy. Someone should remind Amit Shah most of these guys will vote in Nov. Bihar election atleast then he will wake up. Donate to the local people who are helping & donating food to poors. If you're in a big city then I guess you can even donate on platforms such as grofers/zomato. There should also be a relief fund setup by your state govt, you can donate there as well. Sad but true. Since the time PM Modi announced about the lockdown I knew that this is going to be a huge disaster. India is not prepared for a situation like this. We don't have the infrastructure for this. Hell, we don't even have the accountability of our people how are we going to implement something that was thought of overnight. It's just the beginning of the lockdown, we still a long way to go and who knows if the situation is better or not after that. Personally I feel that the government should have left at least one mode of transportation open for people to go with reduced service time. Blanket banning all modes is a very extreme step and it seems counterproductive at the moment. These places like the ones they showed on TV  today and other populous stations like Howrah, CST station, etc are huge breeding ground at the moment. Whatever the government was trying to stop is not happening anymore. Because if one goes down we all go down with them. The people are stuck there with nowhere to go, with no food and improper hygiene and whatever services were being promised is not adequate.

The only thing we can do is donate. Help our house help and the people they know. Help the daily wage workers. Godspeed Whats weird is I thought there would be further notifications, clarifications, and announcements by Modi. None so far! 

His dikatats cause chaos and he doesnt turn up to clear things up or provide any sense of direction. The guy just reads what's on screen. Nationwide Lockdown is what happens when privileged people are untouched by poor people's problem. 

India needs self quarantine. Nationwide Lockdown in India is like burning the house down to kill the rat. The rat might give you plague and you may die, but burning the house down will lead to a much bigger catastrophe. rich people brought disease, now poor suffering for no reason. I am really pissed the government did nothing in Feb, oh yes they were busing buying MPs. If we have restricted foreign travel at that time everything would have been fine. Who the fuck believes china anyway. WHO shithole. So whats your proposed solution? What the lockdown meant - ""Stay where you are. Don't move. Or you might help spread the disease"".             
But, what quite a few people thought about the lockdown was - ""Everything is closed off. Go back home""           

The government doesn't want you to go back to your hometown. People that are walking hundreds of kilometres home aren't going to magically earn money once they reach home. In fact, they're only putting their loved ones in danger.           

But yea, I do agree that the govt should've handed out masks to all the poor people for free.

Edit: to all the people that are furious that I didn't even think about food and shelter.. . Well, the only reason I didn't mention it is because the govt WILL and HAVE TO take care of those. The govt. has already began or will be providing free ration to all the poor and needy.  Food is something that will be taken care of. But if the disease spread like it did in US or Italy, there's no going back, for a country like us.

It's a pandemic. Everyone will suffer to various degrees. Either these people should be allowed to go home or they should be provided with food ,water and shelter with basic hygiene necessities else they are at huge risk. Can somebody please think about the alleged infiltrators in remote camps? What's even the medical facility there?
It will be a genocide.
Remember that Anne Frank died of a curable disease, not from a gas chamber. Another surgical strike. So the people who elected a rioter twice are suffering? Shocker! Didn't the government announce a relief package for the poor? I get your frustration with how the underprivileged are struggling but what's your beef with the privileged? They are at home all day so ofcourse they are going to do dumb shit to pass time and keep themselves sane and busy.


Coming to your other rant about how Govt handled the financially challenged people, look there is absolutely no doubt that an immediate lockdown of the country was required. We don't have time for planning everything from A-Z about every section of the society before shutting everything down. I am not sure if you have seen the spread rate for other countries but it's pretty fucking fast.

Yes it is really really terrible and unfortunate about how the underprivileged are struggling and taking the brunt of this whole shitty mess...but do you have a better way in mind that the govt could have handled things? We have millions and millions of such people in our country. It's impossible to make arrangements for them on short notice. Yes, it'd be government's fault if they fail to do something for these people in the coming days/months...but it's way too quick to criticise the government. Do you have anything better? Tweet at both CMs. [deleted] [deleted]",2020-03-28 01:07:14
Politics,"Smart-locking India: India has political will, resources to shut down country intelligently to counter coronavirus spread",19,fji8vn,https://indianexpress.com/article/opinion/columns/coronavirus-covid-19-outbreak-india-world-cases-deaths-vaccine-6315850/,0,,FuckUforcinme2signup,,2020-03-16 17:29:07
Politics,"“We were all humans until race disconnected us, religion separated us, politics divided us and wealth classified us.”",171,ekw1cc,https://i.redd.it/it41wr3ul6941.jpg,10,,jprbruce," My favourite from the book still is this:


Involuntary order breeds dissatisfaction, mother of disorder, parent of the guillotine. Authoritarian societies are like formation skating. Intricate, mechanically precise and above all, precarious. Beneath civilization’s fragile crust, cold chaos churns. 
Authority, when first detecting chaos at its heels, will entertain the vilest schemes to save its orderly facade … but always order without justice, without love or liberty, which cannot long postpone their world’s descent to pandemonium. Do yourself a favour and read the actual comics. The movie is just a watered down Anti Bush movie Definitely in my top 10 movies of all time. Every single dialogue is quotable To be fair, its just human nature to divide ourselves in tribes.",2020-01-07 00:03:34
