flair,title,score,id,url,comms_num,body,author,comments,timestamp
Politics,Pitting a community against a political party is fucking stupid.,194,futac9,https://www.reddit.com/r/india/comments/futac9/pitting_a_community_against_a_political_party_is/,73,"First of all let me start by saying it was stupid whatever some muslims did at nizamuddin and still are doing by staying hidden and not letting the authorities do their work efficiently. 

But this rant is not just about this situation, it is about people's ignorance and lack of knowledge, people don't understand what is propoganda, and they don't know there history either and they continue to pit up a communuty against a political party. No BJP does not represent Hindus all it represents are the hindu extremists, so when i say fuck bjp, it means, fuck the politicians who are making this country burn. Bjp is the only party who has reached new heights and depths of instigating people to turn on each other, and paint muslims as someone who are gonna attack hindus for no reason. Regardless of what people want, a political party's job is to maintain communal harmony in a democratic country. What part of this people don't undertstand ? and why are dalits even supporting BJP's assholes, they beat up dalits, discriminate against them, all bjp is trying to do is keep brahmin supremacy in this country. Everyone is crazy about religion, i say fuck religion, if you believe in a higher power that is cool i don't care but killing in the name of god, fuck no.

Had to get this off my chest, sorry, and thanks for reading if you made it to the end.

If you have any objections to what i have said, i can conversate or debate sanely but please stop the craziness, use your brains i don't care what your parents, uncle aunties believe in, use your own brains otherwise India is not gonna stay a democratic country, and this is not even a baseless fact anymore, it's all around us, we just close our eyes to look around.",chillinvillain122," Our country is just too far in at the moment and there's no turning back now, our best hope is to believe that we make it to the other side without taking too much damage.

Something much worse than the 2002 riots is ahead of us, it always was but now with the Covid-19 situation acting as a catalyst we are going to reach there sooner. A couple of points

1. I think India is inherently fragile. BJP has not invented something, they are just leveraging the pre existing fault lines. Another thing is that there are so many people who vote for BJP because they are so fed up with the opposition. 

I don’t know exactly but Rahul Gandhi wouldn’t get a lot of crowd in my tiny village. 

2. A substantial part of this country do not care about democracy. People don’t like having to make difficult decisions.

Don’t consider this as a debate to your points, just my PoV. BJP stands for divisive politics. In a state where the minority is a majority they play the outsider insider politics. A place where the majority is the majority the play the caste wala card. BJP is being run like an efficient political business so i don't see when and how it can be stopped. If you kill in the name of religion, your God has already forsaken you.           
- Unknown Though I appreciate what you are saying, Majority of the people are just too naive and uneducated to understand what you are saying.
Lack of Education and awareness is the root cause of divisive politics based off of religion. Your actions show your real motives, not your words. going by your logic, there is no real reason Muslim women should vote for congress as they were the ones opposing triple talaq and it was bjp who made it into law In the US, you say ""Chinese Virus"" and people will call your a racist. 

In India, you say ""Corona Jihad"" you're a nationalist. 

And people say India will soon become a superpower. My ass. If you pay attention, India is becoming the next Pakistan. The only Job of a political party is to stay in power no matter what they have to do for it.
I don't think BJP is at fault, the people of India are at fault. Fuck BJP. Fuck Religious people. Dalits dream of becoming a mainstream Hindu someday where they are treated equally, so they will do what they are told. They forget that they will never be accepted as equal. They are in for a rude awakening >  and why are dalits even supporting BJP's assholes

Because they don't understand how Hinduism promotes Brahminical supremacism, which implies oppression of people like them. That's why they are, and their ancestors before them were, and their descendants will be, dalits!

You can't expect everyone to be as woke as Ambedkar who understood how Hinduism is oppressive to Hindu lower castes. The same people conveniently ignore the numerous Hindu Festivals The reason dalits support bjp is because the rss recruit them at a very young age. Rss targets the vulnerable as in the poor. The poor mostly consists of sc/st. And as such the rss sink their claws into them at a very young age. They're brainwashed by the age they can make decisions on their own they are set in their own ways. This isn't the case for all sc/st some do luckily get away.


https://youtu.be/51h4_wL4Ah0 [removed] Absolutely agreed India is an authoritarian state bro lol [removed] > still are doing by staying hidden

Just to clarify they are not hidden but stranded just like many people during the tirupati or the ones stuck in Ahmedabad for which a special bus was arranged by tadipaar to send them to uttrakhand Are you Muslim OP?",2020-04-04 20:58:28
Politics,"Hit by backlash over posts on lack of medical gear, doctors go silent on social media | Two doctors who tweeted about shortage of protective gear for medical personnel handling Covid-19 cases were trolled, and accused of political propaganda.",408,fpaj1w,https://theprint.in/india/hit-by-backlash-over-posts-on-lack-of-medical-gear-doctors-go-silent-on-social-media/388771/?amp&__twitter_impression=true,67,,hipporama," Well, Some people really deserve to die. ~~/s~~ This country is fucking toxic This is what happens when people are loyal to the party  instead of the country and it's citizens Read similar reports from Tamil Nadu and Telangana.

[‘Who will protect us?’: Doctors and nurses in TN, Telangana allege lack of safety gear](https://www.thenewsminute.com/article/who-will-protect-us-doctors-and-nurses-tn-telangana-allege-lack-safety-gear-121135) We can do what Spain is doing right now,

>[Spain buys medical equipment worth 432 million euros from China](https://timesofindia.indiatimes.com/world/europe/spain-buys-medical-equipment-worth-432-million-euros-from-china/articleshow/74815219.cms)

>**the deal will cover 550 million masks, 11 million pairs of gloves to address shortages in Spain.** ""We have secured entire production chains (in China) which will be working solely for the Spanish government,"" Illa said.

or learn the lesson after suffering like they have,


>['We are collapsing': Virus pummels medics in Spain and Italy](https://abcnews.go.com/Health/wireStory/collapsing-virus-pummels-medics-spain-italy-69789413)

>The coronavirus is waging a war of attrition against health care workers throughout the world, but nowhere is it winning more battles at the moment than in Italy and in Spain, where protective equipment and tests have been in severely short supply for weeks.

>**On Wednesday, the number of medical personnel infected was nearly 6,500 nationally**, health authorities said, representing 13.6% of the country's 47,600 total cases and about 1% of the health system's workforce. At least three health care workers have died.

>**In Italy, where nearly one-tenth of more than 74,000 infections are among medical workers, doctors and nurses have been begging the government daily to provide more masks, gloves and goggles**.

Remember China created new production lines for wuhan, and most of China is coming out of total quarantine while we are going into one. 5 baje thaliyan bajao I don't understand the people of this country at all. They're the same ones that beat the shit out of doctors when something happens because of a lack of supplies. While also using them as scapegoats for thali bhajao bla bla. It's the same with the army. Use them whenever you want to further some sympathy argument but treat them like shit. Wait, so was the complaint legitimate or not? The article isn't clear on this. According to other tweets, the first doctor apparently posted some sort of retraction as well to her claim. Was this under coercion or a misunderstanding from her?

Alt News should probably do an investigation on this topic, as their fact-checking seems to be more rigorous. everyone is silenced.... only JenocideJumlaman speaks. Chutiyon ki kami nahi We respect doctors by endangering their lives.Government should provide ample PPEs to doctors and people should understand that these people are not just endangering their own lives by fighting this epidemic, but their loved ones too and still they are choosing to fight.

Imagine if we send our soldiers in a war without armor or weapons, will we win the war or lose it.This is the same situation that we are in right now.Doctors neither have the weapon or the armor to wage this war for long and this is going to be a long drawn fight.
Also, doctors would be jailed and their license revoked if they refuse to work under these unsafe conditions. We do not need to piss off our medical health services personnel - that should be the rule in best of times, but more so in current circumstances. We are cheap knockoff of China now I would say so what , Doctors go thorugh quite a ragging still . Have the thick skin , thse chutiya social media trolls won't save your life infact it's the other way round. 

Ideally all students/Docs across state should request the CM to procure it . This is the time Or maybe they were spreading fake news and on being called out, they deleted their accounts.

People who have truth on their side and are literally fighting a war with their lives at stake, got cowered by a few trolls?

And PPE is in short supply as the global demand shop up like crazy.",2020-03-26 20:17:25
Politics,A new political party gave a full front page ad in a popular newspaper today in Bihar,728,ff8sth,https://i.redd.it/yjo9wpy38el41.jpg,146,,aaluinsonaout," This looks like an IIPM ad 1. Where did they get funds for such full page ads? 
2. What is the use of English ads in such demographic (Not implying that Biharis cannot read English, but for masses Hindi would have been much better) A party with the name 'plurals' claiming to be progressive with a symbol of a ~~unicorn~~  pegasus In BIHAR. It ticks all the boxes for a ridiculous defeat. [deleted] Looks like some scientology type shit Lol. This is hilarious. Being a Bihari, I totally appreciate the humour in this. Plulols! Kaun jaat ki hai ye?

*Baaki sab dhua hai dhua* Political party Kam koi obnoxious cult jaisa LG rhi hai What a fucking joke. That's not how elections are won. Look at kanhaiya kumar that guy is continuously addressing the masses. Been in top 20 most influencal men on Times. The crowd gathered is humongous and he's not even a mla. That's how you win an election. First of all no use of ad in English in bihar. Even people who know English won't see you as an alpha male/female if you act all high and mighty in such demographic. Bhihar needs someone who can bow down rub dirt on his cut and carry on. Not I join you or I fight along with you. 

But 

You join me  in my fight ... cool.

Looks like 

One more rich kid on the block with illusions of bringing change with top to bottom approach. 

I dont have much info on her. Please correct me if im wrong. CV mein badiya lagega yeh. Looks like a well funded research project. felt cute, opened a party, might get few urban votes later Prashant Kishore planning to release independent parties just like this in every state https://www.pushpampc.com/home.aspx

Alright, which one of you is Pushpam? Chaudary ki chori chunav lad rahi hai. Kuch angrezi ka naam hai party ka. Udne wale ghode ka button daba dena bus. There is a website, smartphone app, big mission statements and demands for donations.

And yet, just lists current problems & their (her) plan to 'challenge' the system.
That's it. No real plan of action or agenda for change.

Just another fresh political science graduate with freshly read ideas from a Karl Marx book. Props to the guy who came up with the Unicorn/Pegasus thing. A little humour in politics is always appreciated. People who are mocking her, should not forget who our PM is and how he became PM. A whole lot of educated mass became ""zombie bhakt""

This party needed attention and look like she is getting a lot of attention with this advertisement. 1) people are shitting on this add by saying that they'll never win. Why ? This is a democracy, people complain about dynasty politics but when people try to break there's hue and cry. 

2) people are not really talking about this persons qualifications or the qualifications of the members of the party ? Are they the iipm of politics or do they really mean it ? What are their promises in the manifesto ? Red & Black. Nice Wow......
That's a new take for any political party......
Won't succeed though unless they reach the ground massess......
Otherwise it is absolutely nothing...... Is this anime party with that unicorn? This is cringy as fuck and the party sounds like a fucking cult More power to her!!! Lol... Looks like it is just her from reading the website.  Where do they get the funding for this? There was a Mahila Empowerment Party that sprung up during the Karnataka election also. 'Plurals' is kinda tongue twister word. Slightly difficult to pronounce for even folks who are comfortable with English. Baqi logon ki baat door ki hai. optimism? The symbol of the party looks like a freaking Wine Company's symbol lmao... This is what happens when you watch a few seasons of House of Cards and decide to start your own political party. ..and she even declared herself a CM candidate already lol r/im14andthisisdeep r/iamabadass r/madlads Strong Mahila empowerment party vibes Woah! Everything about this is weird as fuck. Plus that stare screams evil and makes me uncomfortable. I like their Hindi font. Did some digging, its apparently [Poppings](https://www.indiantypefoundry.com/fonts/poppins) Chutiya Samaj party would still be a better political party name then plurals Sasti Bloomberg Ad looks too progressive for Bihar demographic.

Not insulting Biharis can't be progressive, just saying about general demographic Looks like am low budget TV series poster.

Also the name is dumb. You want to win in India's most backward state with Plurals as party name? Seriously? Okay you got our attention...can we have her for AMA ? Is the party symbol unicorn? LMAO! Wtf....Bihar is one of the top illiterate states aur inki audicity ki CM candidate bhi declare kr Diya.
Bhala kisko samajh aayega There's one main issue with this ad. If you Google plurals you don't get anything about this party . As a digital marketer I'm baffled by their strategy of choosing such a poor name for the party On women's day.. Very apt This rooks like a ""The Room"" remake with female lead instead of Tommy Wissieu I rather place my bet on seeing pig with wings. I'm skeptical of any political party and corporation. Don't think this party has any chance of winning anything in Bihar. Doesn't ring any bells with the voters. Though I appreciate the effort.

Visited the place recently. It's literally like traveling back in time. The people are conservative af. Women are expected to behave in a certain manner, do everything for all the members of the family, eat last and what not.

And as far as the political part goes, I got the feel that it's more about the change in the attitude of the people than just the ruling party. The places are super duper polluted. Like the whole city was a dumpyard. Litter everywhere. Dusty air. No wonder two of the major cities of Bihar featured in the top 15 most polluted cities of the world. 
The roads were bad, yes but there was literally no road sense. People drove on both sides of road, no regard for any traffic rules. And the honking was directly proportional to the acceleration. Literally blow your brains out noise on the road. Yeah... no... ""Plurals"" won't resonate with the masses in *any* state. If you have waste time explaining what your party's name even means... then you've lost half the campaign battle already. Shieeeet. Saw this in the morning but didn’t care to read anything and flipped the page thinking it’s a soap opera/news channel ad. (Not that they are different ) Why does this looks like a cult? This is weird. She's a London based daughter of Binod Chaudhary, a JDU leader. 

Answers a lot of questions regarding funding. This is basically like what OnePlus is to Vivo/Oppo. Looks Promising... She is JD(U) leader Vinod Chaudhary's daughter. No wonder why she came into politics. 

Link: https://shrts.in/bJV9 Saw her educational qualification, atleast she has credibility to become a CM unlike the remaining bozos. Even though i know her laptop promise is 100% fake, i would still vote for her. The chances of her making rash and stupid decisions are really less compared to the other bozos. Also, the chances of her making calculated and logical decisions for the benefit of people is really high. Hope she improves her marketing though. No offense but she looks like a snake,that smile atleast! Eeeeee plurarls kaa hota hai ??? Is it April 1st already? This colour scheme is not working. She looks she's back after having sold her soul to the devil. Yeah right, you are going to win Bihar with a english language ad.


1st step to form a political party in Bihar is to pick a caste (or few aligned castes)

2nd step, is to rope in some bahubalis.

3rd step, is to use whatever leverage your party gets, to make money. C'mon Bihar give us the experience of being a Super Power's Neighbour . From Nepal . I'll let her deal with my snake. Pehle caste bataiye
Phir ideology bataiye
Phir ye bataiye ki opening propaganda kya hoga

Aap chronology ko samajhiye In Russia Putin pays for certain opposition campaigns to run .  Gives him opportunity to claim they are all sorts of things.  Will have to see how this plays out but looks like her Jdu votebabk isn’t very important for all parties Plurals HAVE arrived. Sounds as apolitical and sanghi as AAP.",2020-03-08 14:36:11
Politics,"I’ve been curious, which Indian politicians do you think are doing a good job in politics and why?",42,fs887w,https://www.reddit.com/r/india/comments/fs887w/ive_been_curious_which_indian_politicians_do_you/,51,"Personally, I would pick Kerala-CM, Pinarayi Vijayan (CPIM) and Odisha-CM, Navin Pattnaik, (Biju janta dal). I’m impressed by their efforts to support the poor people during COVID-19 epidemic and Kerela’s excellent health care system deserves credit.",I_can_believe_that," If there is anything positive in the fight against covid, give the credits to institutions like ICMR.    
These politicians are just using the ICMR and state health missions advisories, datas for their own political mileage.   
    
Home ministry saw what the CMs are reaping and hence stopped ICMR from releasing reports, so the central govt can gain some of those PR points for themselves. Capt. Amrinder Singh punjab

He is a no bullshit person. Uddhav Thackeray - because of his daily communique and reassurances. Never ever liked SS, but uddhav over Fadnavis any damn day! Arvind Kejriwal maybe? He's definitely working his ass off, full marks for effort and commitment Udhav Thackrey has been very good so far KCR. Never was or not now a fan of BJP government and have been calling out Yeddiyurappa for the land scam he did during his last tenure as CM. However this time, I really admire the way he is handling the covid 19 situation in the state currently. Not flawless but in a mature way and less fuckups. Sachin Pilot - Deputy CM Rajasthan.
He did great work while he was at Ajmer. Made history as the only non-Muslim candidate to win a majority from Tonk Rajasthan against a muslim candidate. Kerala CM and TN health minister , they make sure that the job they do reaches the intended audience and also they engage with the people directly (via social media ofc).

There are a few administrative officers in Bangalore who are doing a good job as well Late Manohar Parrikar.
The guy was the reason my entire village supported BJP in 2014 election. He had his own views and he never compromised with that. Even at the time of rafel he was the one from BJP to oppose modi-shaha. That's why he was transferred to Goa again. He is the best BJP CM any indian state ever got. He backed beef traders. He restricted spread of Christianity  behind social service mask. But maintained good relationship with people .
When he closed the mining industry for environmental conditions and laws forced by court.He helped poor truck drivers to repay the loan. He used to travel by scooty when he was cm of that country.",2020-03-31 14:59:29
Politics,"In this trying time, let's try to be a little less nationalist/political/racist and a bit more human.",213,flm79b,https://www.reddit.com/r/india/comments/flm79b/in_this_trying_time_lets_try_to_be_a_little_less/,56,"I had a shocking interaction this morning. A bunch of us (various nationalities) were sitting around discussing the news, and one of my fellow indian girls was telling us about a video she saw. A young Pakistani student in China had posted it saying that air India had evacuated the Indian students in his Chinese university and that no one was coming for him. 

There was apparently an overwhelming amount of support from fellow students asking air India to evacuate all students irrespective of race. 

I mentioned that the one good thing that could come out of this virus would be a true and total support for fellowmen. And the girl said ""Pakistan isn't equipped to deal with this virus. They aren't equipped to deal with a viral fever. They could all die.. and it would be a good thing if they were all wiped out."" 
I have never felt more shocked. 

Irrespective of historical politics between our nations, hoping for an entire country to die out is horrible. This is a global pandemic and the best time to set aside all our biases and support everyone. Everyone has loved ones who we're worried about. We are all susceptible to the virus just as much as every other race. 

Let's put aside religion and take care of each other.

I'm probably going to get some hateful comments about this post anyway. But I don't care. This is me imploring that we all stand together (at a social distance, no touchy) and try to keep ourselves and our neighbors safe. Thanks for coming to my TED talk",ThatRedScooter," What an incredibly narrow minded person. Our great grandfathers were from the same nation. People in Pakistan are humans too. I personally hate both Pakistani and Indian governments but that hate shouldn’t be transferred to the people under them. Meanwhile in the Zee News Cinematic Universe:-
        [PEICE of shit channel](https://youtu.be/FFJNGAqK6Zw) > And the girl said ""Pakistan isn't equipped to deal with this virus.  They aren't equipped to deal with a viral fever. They could all die..  and it would be a good thing if they were all wiped out."" 

She said this in front of people from other nations too ? She is living abroad, did she never shop in a Pakistani shop (half the so called ""Indian shops"" are run by Pakistanis, at least here in Europe) or interact with Pakistanis abroad?

I would understand if someone within India says that, because lets face it, with the current political atmosphere in India, that would not be surprising at all. But living abroad and saying shit like this is... she is a horrible person. [deleted] [Here ya go, another thread. It is a lost cause.](https://np.reddit.com/r/india/comments/flmmps/man_riding_motorcycle_beaten_up_in_maharashtras/) I am in two minds about this.

I do feel that we shouldn't in general dehumanize people. It *seems* grossly unfair. The wars and games between our ruling classes shouldn't destroy our humanity as individuals.

But there's also this angle: the members of a tribe (religion, nation, race, caste, ethnicity, etc.) need to be aware that the tribe's harmful actions towards others will exact a toll on them individually. For instance, if members of caste A are especially casteist and/or communal, then individuals from that group should feel the heat for it from others, even if the individual himself or herself may not be casteist or communal. Otherwise they will have that much less incentive ""fix"" their tribespeople.

I have used this principle with respect to myself. If I am hated because members of my ""tribe"" exhibit certain undesirable behaviors, then while I may not ""deserve"" it, I certainly should realize that the reaction is expected, natural, and even healthy, in a way. It gives me an incentive to fix the harmful actions of my fellow tribespeople. Hating or punishing the members for the transgressions of their tribe is a normal strategy used in tribal calculus. It may not be healthy individually or collectively to suppress this ancient instinct. Just like our instincts for revenge and sexual jealousy, it might exist for a reason. r/ABCDesis If the government allow us :). > and that no one was coming for him.

ha he'd most likely be better off staying in China Is that what they call trying Humanism? Brother you are preaching to the wrong crowd. You need to post this to other hateful subs. >	I mentioned that the one good thing that could come out of this virus would be a true and total support for fellowmen. 

