flair,title,score,id,url,comms_num,body,author,comments,timestamp
Scheduled,"None want to be born Scheduled Caste, says Chandrababu Naidu",35,452iuf,http://www.deccanchronicle.com/nation/current-affairs/100216/none-wants-to-be-born-scheduled-caste-says-chandrababu-naidu.html,77,,Ramu92," there are 19% dalits in andhra. Why do bjpand allies are just waving red flag in front of dalits ? Nobody asked to be born Indian, or even Human for that matter.

Sad to see **this** guy resort to going after  low hanging fruits. None want to be born Scheduled Caste, says Chandrababu Naidu

---

>* Hyderabad: AP Chief Minister N. Chandrababu Naidus comment: SC lo puttalani evaru korukuntaru?

>* ) drew flak from the Opposition parties on Tuesday.

>* Mr Naidu had made the comments on Monday while criticising caste politics.

>* A complaint has been filed with the Tangutur police station of Prakasam district against Mr Naidu by Dalits who alleged that the comments attracted sections of the SC/ST Atrocities Prevention Act.

>* AP Congress chief N. Raghuveera Reddy said that in his next life he wanted to be born an SC and added that Mr Naidus comments were atrocious.



---



Here are some other news items:^credits ^to ^u-sr33

> * [I told PM to implement all assurances given to Andhra Pradesh, says Chandrababu Naidu](http://www.deccanchronicle.com/151024/nation-current-affairs/article/i-told-pm-implement-all-assurances-given-andhra-pradesh-says)

---

^I'm ^a ^bot ^| [^Message ^Creator](http://www.reddit.com/message/compose/?to=sallurocks) ^| [^Source](https://github.com/hunkdivine/samacharbot2) ^| ^Did ^I ^just ^break? ^See ^how ^you ^can ^help! ^Visit ^the ^source ^and ^check ^out ^the ^Readme I would love to have been born as a Brahmin though. I could hate everyone else for being inferior. I could be a dumb and terrible student who couldn't get into IIT and then blame it all on reservations. I could insult the fuck out any Dalit and still get away with it. I could get preferential treatment from government officials. I could actually get married to anyone I loved. Because hey, when I'm at the top, everyone wants to be me.  Am I right or am I right? hmmm. i don't agree. i'd love to give up my general category and be reborn in a SC family considering all the reservations and attaining what I want in less struggling manner. Imagine, less hard work, more of luck= a better future.
 If the SC family is rich and on top of that you are getting reservations, why not?

Also I didn't decide to be born Indian, its not like I was given a choice. Reservations now should be based upon family's income and not caste This is so true. And I'm glad someone spoke out. As an upper caste guy, I'm sick of hearing all the casteist taunts on Randia. Imagine how traumatic it must be for a Dalit! Thank god for reservations and vote bank politics. Our country is enough of a racist and casteist nation anyway. ",2016-02-10 20:49:07
Scheduled,It is time to break the silence around casteism among Scheduled Castes,13,8dl0lh,https://theprint.in/opinion/it-is-time-to-break-the-silence-around-casteism-among-scheduled-castes/50835/,2,,mubukugrappa," When you read in the news, Upper caste men beat up Dalit or lower caste. Always remembers, upper caste here are not the brahmins, it's the upper caste SC/ST. 
2 major castes in KA are, Madar, Byadar (ST) and Naiks (Not Nayak, they are different) 

* A lower caste SC/ST will not be able to get his hair cut from a upper caste SC/ST. 
* Lower Caste SC/ST will not vote for a upper caste SC/ST and vice versa. They will vote for the lingayats (This is in Karnataka only)
* Lower Caste SC/ST is not allowed to drink in a glass cup in an upper caste owned hotel, they are given disposables. 
* ST's consider themselves superior to SC's. 

Also, not anyone can open a Laundry shop, you need to belong to the Agasar caste, anyone ele will be beaten up, do not expect police to come to help, they stay out of caste matters. Only expections are muslims, but they do not practice this trade. 
Similar for a barbers too. 
 India is a country having numerous castes but we should not quarrel in the name of castes.",2018-04-20 12:45:08
Scheduled,Is Ad Astra not releasing in India?,53,d5k77e,https://www.reddit.com/r/india/comments/d5k77e/is_ad_astra_not_releasing_in_india/,73,"Can anyone help me out with some info? 

Me and my friend were really excited to book tickets for it as it was scheduled to release on 20 September, 2019 but BookMyShow is showing the release date to be 27 December, and then when I checked furthur in the 'Coming Soon' section it wasn't even there!!
Any kind of info would be helpful thank you!",m_o_s_e_schrute," Ad Astra is definitely postponed. BookMyShow replied to some tweets that they have received an update the date has been changed to December. I live in Kolkata but I checked listings of other cities, all the 20th September releases like The Goldfinch and Rambo have been put up already. Ad Astra not releasing. It sucks as I was really waiting for it to release since the brilliant reviews from Venice Film Fest. But in India, even Brad Pitt can't pull people to theaters (fucking hell even Brad and Leo together couldn't pull people for Once Upon a Time...). So yeah they are shelving it indefinitely for awards season, it might even not get released. Being someone who is a theater regular and crazy about films, I have been disappointed far too often. This year itself The Favourite and Widows didn't get a release even after getting release dates and social media confirmation from the studio. Got pulled last minute. I fear the same has happened with Ad Astra. Its definitely not a CBFC issue since I couldn't see any content in Ad Astra (from the trailer and reading revews whatever I understood) that would cause problem or wouldn't suffice an A rating. Not gonna lie. Spent the last hour calling Theaters and asking them when ad astra was releasing. They said it's definitely not releasing this week, but might be the next. I wouldn't put too much money on that. 

It's been a pretty disappointing year for movies in India. Midsommar isn't releasing. And it's highly unlikely that The Lighthouse will too. It's fairly common for Indian cinemas to not release indie movies but to postpone movies like Ad Astra is a new low. I was able to find it yesterday, but now it’s completely gone from all apps. Last I saw, it did read 20th September on BMS and PVR app. Ok this is my theory. Ignore if its dumb.
There are 2 Fox movies(Mission Mangal and Chhichhore)  already playing and Zoya Factor is also a Fox movie releasing today. Maybe there are any rules and regulations that these many movies shouldnt be played by same studio at a time. So they might release Ad Astra after pulling out one of these movies from theatres, one to two weeks later hopefully.. Movies like chichore are selling out tickets but Indians don't watch movies like ad astra.

I literally waited for 2 years and all this makes me very upset.

When will Indians raise their level? It's very frustrating for a cinephile. This is the [release schedule](https://www.imdb.com/title/tt2935510/releaseinfo) according to IMDb.. The Lion King and Spiderman FFH are getting re released for strange reasons no one will ever know. All Indian news articles say Indian release date is 20th September 2019. Unfortunately i can't find any Twitter handle for '20th century fox India' and bookmyshow support is useless about this.
We will know for sure by Thursday when bookings will start.
Edit: just saw it again under 'coming soon' and release date as 20th September. Hopefully tickets are available on Thursday as usual. I have recently stumbled into a woman on Tinder who loves stuff about deep space just as much as I do , if not more, and we have planned to go on a movie date(our first date) to Ad Astra. I have taken up the responsibility of booking the tickets and I am growing anxious with each passing day not able to find anything remotely related to the movie on BMS. I remember reading articles about Brad Pitt asking a NASA astronaut aboard the ISS on a phone call, as a part of promotions, about Vikram lander. But nothing is written about it's release at all. @FoxStudiosIndia is the Twitter handle Here's what bookmyshow replied to my tweet 

""Hey wewakejaw, as per the update, this movie has been postponed and the release date is not yet finalized. Thus, the release date is tentatively updated as of Dec 2019 on the movie page. For better clarity, pls DM us your contact number. -MB Rambo is being screened but not this movie. Sigh. Was super excited for this movie and now it gets postponed. Don't know why It's getting postponed though. As a lover of sci-fi movies, I was anticipating this movie for some time. It's disappointing that it's not going to get released tomorrow. Movies like these need to be promoted more in India so that more of the audience get to know the gap in cinematic brilliance between Hollywood and Bollywood movies. This sucks man. I was so excited for another deep space movie , I even put the movie release date on the calendar ಠ_ಠ 

Then it disappeared from BMS coming soon . I was so confused. Everywhere it said it'll release on 20th , no news of an indefinite delay was announced . Very sad. Maybe because they dont want to compete with rambo , I hope one or two weeks after it ad astra would have a release date.

Bookmyshow told me that december is just a tentative date and not confirmed. The most stupid decision by big Hollywood studios just shoes how much they care about audience and what they want pathetic. Wanted to experience this on Imax but no because some money making bullshit we won't get. Ready or not released in India I guess they don't consider Brad Pitt a star now. Pathetic Just checked on Book My Show. It's showing Oct. 31, 2020 as release date for Ad Astra. WTF? How can they push it a whole year later?? It disappeared from PVR app (coming soon schedule) when I tried to checkout the shows for this friday. Looks like Rambo is gonna fight the mexican cartel and then find Tommy Lee as well;) I don't get it, why would they delay the release of such a movie?
As far as I can tell, India has a growing fanbase for sci-fi I'm angry. It's not releasing in India and it sucks. Isn't is awesome that we broke the Babri Masjid :) Hurray for us! This sucks man! I was really looking forward to this movie esp. after all the rave ratings! This is exactly what happened to READY PLAYER ONE last year. The movie wasn't available anywhere in Mumbai :( 

As for the Dec 2019 release on BMS, I wouldn't pay much attention to it. I just hope they pick up one slot some time in the next two weeks to screen it. 

Such movies are meant to be watched in the theaters and I wouldn't wanna miss it. I'm heavily disappointed and pissed. I waited for it like hell and was updated about everything related to it - screenings and reviews. And now I see this. Can anyone tell me what might be the exact reason for this? They're releasing Goldfinch, which is getting universally panned and is somewhat an artsy flick but not Ad Astra, a sci-fi flick with Brad Pitt. I don't understand... Damn...I myself was searching for tickets considering it was supposed to be released today. Like wtf man...seriously...DECEMBER!!!

And then people complain about piracy in India. here :(   


 [https://twitter.com/its\_jaswinder/status/1175034323679895552](https://twitter.com/its_jaswinder/status/1175034323679895552) You need money to release and on top of that they definitely need the profit back. Not many people prefer to watch these kind of films but US, and I assume maybe the production company (FoxStar Studios India) looked at the previous statistics and took a call that it doesn't want to shell out and lose. Fuck man I was waiting for this !!! TPB, here I come! I've lost hope that it will release in theatres.
I'll keep listening to this beautiful piece of art from the movie till then.

https://youtu.be/PjzZ_0KSYVg

And please dont encourage piracy, you wont do that if you love and respect films and filmmaking. Just saw the film in TGV cinemas IMAX Penang,Malaysia. India is missing a beautiful, hypnotic and religious cinematic experience. I can't even begin to describe the kind of emotions and melancholy that flows through you when watching it. Also a visual masterpiece that cannot be done justice on a small screen Ad Astra got postpone to December 2019, but it won't be releasing in india now. This is confirmed news BMS is now showing release date in Late 2020 oh man, it makes me sad. I really wanted to watch that movie on the big screen. Its on RARBG now. Its a visual treat. Wish i got to watch in the theater. Ahh.. makes me so happy to see people talk about this..Being a cinephile..this thing always made me so damnn frustrated..
I was completely devastated when I heard that Ad Astra won't be releasing in India..then BMS was showing that its gonna release in late Dec..and now when I'm checking it..it looks like the movie page itself has been removed..",2019-09-18 01:27:31
Scheduled,"For the first time, there are more than 1 Crore speakers of a Non-Scheduled language : Bhili/Bhilodi at 1.04 Crore.",12,8w7h1r,https://www.reddit.com/r/india/comments/8w7h1r/for_the_first_time_there_are_more_than_1_crore/,0,"http://www.censusindia.gov.in/2011Census/Language-2011/Statement-8.pdf

The top 5 non-scheduled languages by speakers are :

Bhili/Bhilodi : 1.04 Crore
Gondi: 29 Lakh
Kurukh/Oraon: 19 Lakh
Khandeshi: 18.6 Lakh
Tulu: 18.46 Lakh",Daldawala,,2018-07-05 11:50:25
Scheduled,In seventh heaven: BJP feels 'lucky' about UP poll schedule,4,b7vh0q,https://www.outlookindia.com/newsscroll/in-seventh-heaven-bjp-feels-lucky-about-up-poll-schedule/1506552,1,,dogaa, The polls are starting from the western UP because since we have lots Muslims the campaigning will concentrate on development initially and after they have voted it will shift focus  to religion.,2019-04-01 09:19:27
Scheduled,Yet another bandh in Karnataka scheduled for the weekend. Will a petition against it work?,2,7u7hnw,https://www.reddit.com/r/india/comments/7u7hnw/yet_another_bandh_in_karnataka_scheduled_for_the/,8,"[High Court notice to Karnataka government, Vatal Paksha on petition against bandh](http://www.thehindu.com/news/national/karnataka/high-court-notice-to-karnataka-government-vatal-paksha-on-petition-against-bandh/article22581533.ece)

",moha_n," Vatal Nagaraj is a buffoon and has no business calling for bandhs. I don't think he has the public support or money necessary to execute a bandh. Hopefully it will flop. Petition against petition? Yeah sounds fine. To be honest, this Bandh is not going to work, it will be a flop show. Shops and establishments will run as usual and since it is on a Sunday there won't be any impact on educational institutions. This bandh was organised because Modi was supposed to be in Bangalore on 4th for a rally, the govt wants to disrupt it.",2018-01-31 12:58:00
Scheduled,Crimes in Delhi,54,dikkb9,https://www.reddit.com/r/india/comments/dikkb9/crimes_in_delhi/,24,"Hi guys,

I am sorry if this post doesn't belong here or If it sounds like a rant but just 2 days back, I just came to know that my cousin's dad was attacked brutally by 2-3 goons in Dwarka at night when he was returning from work on his bicycle. He got off the metro at around 12am at night and was on his way home when he was stopped and beaten mercilessly. The goons didn't rob him and stopped only when they saw a PCR van approaching.

He is in the hospital now and had multiple scans done and is now scheduled for jaw surgery. This is truly heartbreaking for me as their family is really nice. They are a family of three, all of them highly educated, hardworking  and soft spoken people. He returns late from work everyday and rides his bike from the metro station to home even though he has a car just to stay fit while also reduce carbon emissions from his side.

The police doesn't seem to be helping much and are treating it as ""just another everyday case"", like this is normal and expected at Delhi streets. And ofcourse I expect nothing ever to happen to the people who did this, and I am pretty sure they wont get caught.

Just wanted to put this out there, stay safe people and care for your loved ones, you never know what could can happen on the streets of New Delhi.",ItsSuplexCity," When and where exactly? There seems to be zero mention in the media. At this point, all I want is for these guys to get caught, but the more I talk to the family it seems like that is not going to happen. [removed] Why was he attacked? Was there an altercation or was it totally random? Were the goons drunk? Idk why but this seems more like an intentional assault rather than your uncle being at the wrong  place at the wrong time. Unless their have been cases where the goons didn't rob We need an r/India vigilante squad. Are you saying he carries his bike/cycle in the metro? How? Sorry for your cousin's father but riding a cycle at 12 in the night is a really dangerous thing to do! That is the case of every city. Poor people commit crime because they have nothing to lose, they will just disappear. Rich people can just pay money or have connections and get away. I read or hear about stabbings, murders and robbings everyday in bengaluru. I have had first hand experience, bunch of drunk people on roadside wanted to beat me and my friend. One of them came with big piece of wood, it looked like he wanted to beat me to death with it. I had to run. Lmao. You're delusional and utterly careless if you didn't expect this. One should assume they're always liable to get robbed/mugged/assaulted/raped/kidnapped. You just take precautions and be sensible.

Police is taking this as an every day case because it *is* an everyday case. All you're gonna get out of this is an FIR report for your insurance needs, and ammunition in governments arsenal against these goons, lest they commit more serious crimes in future against more significant people.",2019-10-16 13:13:38
Scheduled,DO and DONT of flight travel ( Due to increase in flight anxiety threads and for future if anyone wants reference),19,dsirfe,https://www.reddit.com/r/india/comments/dsirfe/do_and_dont_of_flight_travel_due_to_increase_in/,18,"Mods kindly make a thread for it. Copy paste this content if you like. Flights are a bit of serious business and I can understand why youngsters might feel incredibly anxious 

Some important things to keep in mind first - 

1. Your flight ticket has to be shown to security outside and check in counter. It can be printed as well as shown from mobile ( Avoid taking screenshot of website from where you confirmed your ticket. Take the PDF/JPG which you get via mail from the site. )

2. All domestic flights have a STRICT 45 min closure of check in before their scheduled departure. So make sure that you reach AT LEAST 1.5 hours before your flight. In case you are reaching 1 hour before ( hurt shy of 15 mins for check in closure), kindly INFORM the personnel there that your flight is of that time. Often, they will start to call you themselves by saying FLIGHT TO XYZ area, anyone there. But to be on safe side, do ask personnel there.

3. Airports are supposed to be one of the best and most organized places of any city. So you can expect that there will be proper signboards to guide you.


DO- 1. Keep your power bank inside your handbag and your other stuff like knives,scissors,liquid greater than 100ml inside the check in baggage. 

2. Keep.your power bank, chargers, laptop in your hand baggage. 

3. General weight limit for domestic is 15 kg in check in and 7 in Hand baggage. 

4. In any doubt, ASK the personnel at airport, especially the airline you have booked. Like if you have booked Air India or something, ASK them any doubt. Remember, they are there to help you only.



DONT - 1. DO NOT PANIC during security check. It is simple. You need to keep your belts, chargers, wallets, watch, mobile and laptops etc in one tray and your bag in other tray. Don't worry, the army personnel there just look scary. They are, in fact, VERY helpful. 

2. Ok this is a common mistake women do. Your bags are Pandora boxes. Often you women go in security check and VOILA, you have scissors, knives ( MULTIPLE) and 2-3 bottles coming out of your bag. Remember all those items are broken there as they can't be taken in flight and you can't do anything for sharp objects. And you have to discard liquid if your bottle is filled and js more than 100ml. So kindly CHECK YOUR HAND BAGS BEFORE LEAVING FOR AIRPORT. 

3. DO NOT abuse the airline members for any delays which are not their fault. Remember they are mostly doing everything they can to solve your problem. And if they can't, chances are you were the reason ( Like you coming 40 mins before flight and check in is closed.) Don't be the guy who screams - I KNOW YOUR MANAGER/MAALIK/OWNER/DAD etc. 

4. DO NOT worry that you will crash lol. Many people who are travelling for first time may be scared. I don't blame them as flight crashes are always big news.

However rest assured because the chances that you will get into a car accident is HIGHER compared to you getting in flight accident. Seriously. It is THAT safe.

If I remember more stuff, I will mention it here. Others also please combine and add stuff which I may have forgotten. I am a busy man",heteretes," >I am a busy man

Playing doctor-nurse again? Do you work at the airport? Stop posting here. Every post and every comment of yours comes off as arrogant. We don’t need people like that here. Stop fishing for upvotes. You won’t find them here.  For domestic travel, instead of queueing, use self check-in kiosks.  Saves you time. Time in queue can be 30+ minutes in busy airports and hence tiring.

You may not get your preferred seat, but that is okay for me. Yaas dear , hum hii akele berozgaar hain But people survive car accidents.. how many survive plane accidents?

>However rest assured because the chances that you will get into a car accident is HIGHER compared to you getting in flight accident. Seriously. It is THAT safe.",2019-11-07 00:33:57
Scheduled,Times Litfest Mumbai cancelled because ‘seriously floundering economy’ has kept sponsors away,71,ddre54,https://scroll.in/latest/939568/times-litfest-mumbai-cancelled-because-seriously-floundering-economy-has-kept-sponsors-away,12,,Ajaatshatru34," Must have asked just the underwear companies and car companies. Pakoda companies are flourishing though. Time to ask LIC to sponsor and bail out the litfest.. FIR kaato re /s Lol @ Vineet Jain and Times group. So much time and effort sunk into trumpeting a ""strong stable visionary business-friendly government"" for 6 years on TV and print, and at the end of it all, they can't even fund a get together for a few pretentious ""libtards"". but muddi ji just created 25 lac entrepreneurs by giving 80k crore mudra loans Antha baagundi [deleted] He He... You know noone wanted to sponsor it because lit fests are usually dominated by liberal minded authors thinkers etc..

economy to bahana hai.. Since all the right wing chus have no problem sponsoring any inane shit they want to do.",2019-10-06 02:44:26
Scheduled,Need help with scheduling test with Prometric over the weekend,2,aalc9g,https://www.reddit.com/r/india/comments/aalc9g/need_help_with_scheduling_test_with_prometric/,7,"I had the bad Fortune of being doubtful about taking a test that was scheduled for 31st of this month at Prometric Chennai. Once I cancelled did it hit me that I shouldn't have. By the time I tried to get in touch with them by 540pm, their answering machine was on. My test slot runs out on 31st, coming Monday(day after tomorrow). Their online chat will not be available for next 2 hours that's US chat service, don't really know if they can solve my Prometric India issue. I see my cancelled date being available to book. But their online services require us to make payment over phone. I want to take the test on 31st. Is there a way for me to make the payment for rescheduling now. Stuck in the weekend what to do now pickle.

Q. How do I get in touch with Prometric to pay the rescheduling fee, in order to book an appointment for Monday 31/12/2018?

Any advice would be appreciated. Thanks in advance. 

PS : this test has been larger than life for me over the past year. Any help will mean a lot to me.",ed_edd_eddy_fu," What's the question again? Google and approach offline prometric centres in your city. Consult them, they have the access and terminal to solve your issue.

Good luck. Not sure what exam you are attending, stay calm and do your good. That's enough.",2018-12-29 21:49:10
