flair,title,score,id,url,comms_num,body,author,comments,timestamp
Scheduled,Delhi Govt Sources: Names of CM Arvind Kejriwal and Deputy CM Manish Sisodia dropped from the school event where Melania Trump is scheduled to visit. Delhi Govt Sources claim both were to attend the programme since the school comes under Delhi Govt,305,f7ogd8,https://twitter.com/ANI/status/1231093900518932480?s=19,30,,The_andh_bhakth," This is beyond petty. > The inclusion of a Delhi government school in the high-profile visit is interesting, given the ugly row during the election campaign in the capital over the BJP posting videos that they said ""exposed"" the poor state of schools managed by the Kejriwal government

> Delhi Chief Minister Arvind Kejriwal and his deputy Manish 
Sisodia will not be part of an event next week when US First Lady Melania Trump is likely to watch a ""happiness class” at a Delhi government school.

Lol,bjp is just embarrassing itself now! Well kejri shouldn't waste his time in stroking the ego of that Orange tumor and his wife anyway. I am sure he has better things to do. Petty af. Not a loss in my book though. Meeting a trophy wife of a nincompoop wannabe dictator achieves nothing. They can spend their time doing better things in the day. Insecurity level - Mudiji! Modi wants to show off the school as one of his own achievements instead of AAP's. This is just juvenile. Lol My previous manager at work used to do that. My team's ideas were presented to higher management but he would not forward the invite to us. He would get all credit. Modi is so petty ! Saala kitna insecure hai ! (How insecure is he !) Just a month ago modi and Shah were crying that there was no work done in Delhi schools. Now they are showing the schools off to the world. 

Fastest about turn by jumlu.. Since NRC. [deleted] Such insecurity much wah modiji wah!! Trump ko vannakam. As usual Modi takes credit for others work Credit babu bhaiya, credit. /s Hahaha serves them right for all the bootlicking and hanuman gimmicks. Kejriwal crying in a corner for missing opportunity to meet Trump. 
He's just a glorified mayor of Delhi. Has no control at all. 😂😂",2020-02-22 13:52:01
Scheduled,"Delhi: AP Singh, advocate of 2012 Delhi gang-rape convicts arrives at the residence of Supreme Court Registrar. The convicts are scheduled to be executed at 5:30 am today.",16,flgvah,https://twitter.com/ani/status/1240731289075871744?s=21,22,,devCR7," My hunch is , this guy is trying to expose the loopholes in the legal system.  

Never met this guy . I dont know him , but he has been  working with the same dedication from  the very beginning.   Its hard to stay that way with out underlying cause.

I may be wrong. The guy who bragged, ""they'll never be hanged"" it’s a developing situation IT IS OVER, the SC has dismissed the plea seeking stay on the executions, the rapists should be hanged in an hour or so. Got to admit. This advocate is dedicated. If I rape or kill someone, I'd want him to be my lawyer.",2020-03-20 04:12:26
Scheduled,Why the Supreme Court’s verdict on SC/ST quotas has created a political storm | It has upheld the state’s powers to deny reservations to Scheduled Caste and Scheduled Tribe communities.,108,f1o839,https://scroll.in/article/952687/why-the-supreme-courts-verdict-on-sc-st-quotas-has-created-a-political-storm,47,,rahulthewall," Muslims and reservation are two distractions used by Indian elites to confuse people. These two are blamed for all of India's problems and people are stupid enough to believe it. 




Honestly, as a dalit I sometimes wish let them remove reservation. Then let them explain to masses how 1% Indians are getting 73% Indian wealth. Within decade there will be riots in streets and true people responsible for Indian poverty will be found out. Sizable dalit tribal population doesn't understand how system is rigged against them, they think reservation is making some difference. These guys can finally wake up. You have 22.5% reservation for 29% SC,ST in government jobs which are just 4% of total jobs. And people think this is useful or something. The main question we need to ask is where are the damn jobs ? I have said previously that Scheduled Castes and Tribes are next on the list after Muslims.

Looks like I was wrong. They're targeting everyone at the same time, just with a different approach. >The other problem is also the court’s selective affirmation of the state’s discretionary powers for providing reservations. When it comes to a decision not to provide reservations, the court feels the state has absolute discretion and need not collect data to justify this decision. But when the state wants to provide quotas, the court brings in the concept of equality and places several restrictions that dilute the discretionary power of the state. The 50% ceiling for quotas is an example of this restriction.


This alone is enough to show how the SUPREME COURT is disingenuous and biased as hell and their end goal isn't equality of any sorts. First they stopped making it compulsory for promotion in government jobs and now will give only lower level jobs to reservations.
Second they stopped compulsory arrest in SC/St act and will give pree arrest anticipatory bail to the accused.

This is the destruction of the act itself. 

Bc reservation is not the government spooge to give its a bloody constitutional right. Get that modi shah I wish the govt does try fucking around with the reservations. I truly pray that they somehow think that by making their stooges pass such judgements that they can alter the basic tenets of reservations and try curtailing it. It will be the end of this govt. Period. Come on BJP/RSS! Try messing with reservations. Please. You can do it!! Show us how tough you are. First Moslems , now SC/ST ; good job BJP judiciary /govt . Golly what is with this government? Talk to upper caste, and they believe BJP is shit and giving SC/ST everything. Talk to SC/ST, they say its upper caste party

Who the fuck voted for these mfs? I believe reservations  should be based on economic conditions and not on caste.
The reason is many sc's and st's have a high family income yet take advantage of reservation.
On the other hand there are many general candidates that have very low family income yet have no such advantage.

Reservations(if any) should be used to lift the distressed classes and not lift the already uplifted.",2020-02-10 18:00:46
Scheduled,What about the entrance exams scheduled in May?,9,fvcvo1,https://www.reddit.com/r/india/comments/fvcvo1/what_about_the_entrance_exams_scheduled_in_may/,3," CLAT, AILET, NEET, JEE have been postponed but only by two weeks or so. Would we be able to take these tests on the postponed dates with the way things are going? Would it be settled by the last week of May? Thanks!",plsacceptmyusername," Bachega India, tabhi toh Padhega India. Gand maraye entrance exam

First stay alive Nobody can predict. Wait for the official announcement. Till then, prepare hard. Such opportunities to prepare doesn't come often.",2020-04-05 20:13:31
Scheduled,"Advisory: No scheduled international commercial passenger aircraft shall be allowed to land in India from March 22, 2020 for one week.",36,fl8zf5,https://twitter.com/PIB_India/status/1240610716106633216,4,,aviakki1, Oh boy. Chalo bhaisahab. Sabji ka dukaan main dangal time What happens to outgoing flights? Does any one know? Should have done this a month ago,2020-03-19 20:08:46
Scheduled,My roommate is in India (he's an Indian and not an American citizen). He's scheduled to arrive on Saturday. Will this impact his return?,29,fhgyhu,https://www.reddit.com/r/india/comments/fhgyhu/my_roommate_is_in_india_hes_an_indian_and_not_an/,4,He was working remotely from February 24th and scheduled to arrive this Monday the 14th. Is his return at risk of being delayed?,Sorry-Operation," AFAIK, U.S. still hasn't banned entries of Indian citizens so that shouldn't be an issue. But check with the airline he will be flying and check the advisories of the country he will be transiting through. Like Qatar Airways has banned Indians from flying.

Edit: Qatar Airways hasn't banned Indians. You can still transit through Doha. But Indians are not allowed to enter Qatar. Maybe",2020-03-12 22:13:41
Scheduled,No ministry scores 100% on fund utilisation for Scheduled Castes,49,fg8v3u,https://m.economictimes.com/news/politics-and-nation/no-ministry-scores-100-on-fund-utilisation-for-scheduled-castes/amp_articleshow/74557648.cms,1,,Aarkay," But we are funding Sanskrit Universities with Public money.









Same public who would have had molten lead poured into their ears for listening to sanskrit just a century back.






Now that it's dead it's part of 'indian history and culture' and they need our money to keep it relevant.",2020-03-10 13:20:33
Scheduled,"Hydroxychloroquine now a schedule H1 drug, can be sold on prescription only",25,fpr0on,https://www.mohfw.gov.in/pdf/218927g.pdf,4,,knowsalotofthings, Someone give me a ELI5? What's this drug used for? [deleted],2020-03-27 12:59:03
Scheduled,"Maharashtra govt: All schools in urban areas of Maharashtra (all govt & pvt schools in jurisdiction of Nagar Panchayat, Nagar Palika, Mahanagar palika) to remain closed till 31st March. Only exams for class 10th, 12th, & University exams will be held as per schedule #coronavirus",29,fii4k1,https://mobile.twitter.com/ANI/status/1238813995403890688,4,,Captain_Banana_pants," Bc students in 12 and 10 are not immune to the virus you fucking dickheads. Indians have some fascination for giving exams, not the actual knowledge behind it. Even if the world goes up in flames in a nuclear war, some random Indian kid would be soliloquizing the half life formula for plutonium as a mushroom cloud rises in the horizon. The lives of university students,12 graders and 10th graders are less important.



The lives of their families are less important as well.",2020-03-14 21:10:49
Scheduled,[AskIndia] Indigo cancelled flight less than 8 hour due to bad weather before the scheduled departure without providing alternate flight. Can I claim compensation other than cancelled flight refund?,12,egtg1j,https://www.reddit.com/r/india/comments/egtg1j/askindia_indigo_cancelled_flight_less_than_8_hour/,12,"I had Indigo flight from HYD-BOM on 14th Dec @ 12:25 AM. On 13th around 4:30PM Indigo sent SMS informing me my flight is cancelled due to bad weather in Delhi. I had another flight from BOM so I had to book another flight HYD -BOM which was of around 17K Rs.  Indigo denied any compensation when I contacted their customer care and in Airsewa APP they closed the ticket citing as the weather was bad and it falls under the category ""situation is not in their control"" and they cannot provide any compensation.  Should I go ahead and file complain in consumer court ? Has anyone had any similar experience and able to get any compensation from the airline other than cancelled flight refund?",aishware," Yes I think you are legally eligible to claim compensation but it's a tedious process if you try to do it by yourself. Indigo SpiceJet or literally any other carrier design their claiming procedure to be insanely complicated such that people give up midway. But fortunately these days there are startups who'll do the job for you for a percentage of the compensation amount. I'll suggest to go for those. It'll save you a lot of time, energy and frustration. And it's free too, they charge only when the claim succeeds. I'll suggest instalocate or refundme. Fuck indigo, I was taking a flight from Dubai asked me a copy of my credit card with which I made booking. No, they are only entitled to give you a refund or a ticket for the next available flight in case of cancellation due to bad weather.

Since it was no fault on their part the court won't punish them and will almost always rule in their favour Can you ping me on my number 8010510738 or on my email [mohitadvocategarg@gmail.co](mailto:mohitadvocategarg@gmail.com)m . Need certain detail before proceeding like whether the connecting flight was on the same ticket number and which airline was it? Go to consumer court before that consult a lawyer Looking for answer of this question.",2019-12-29 01:28:49
Scheduled,Nirbhaya Case: SC quashes death row convict’s plea against rejection of mercy. The four death row convicts in the case are scheduled to be hanged at 6.00 am on February 1,30,evio1q,https://www.moneycontrol.com/news/india/nirbhaya-case-sc-quashes-death-row-convicts-plea-against-rejection-of-mercy-4871711.html,0,,Ku_hu,,2020-01-29 13:47:34
Scheduled,Let's fix our sleep schedule,14,f3wido,https://www.reddit.com/r/india/comments/f3wido/lets_fix_our_sleep_schedule/,11,"Hey guys, I thought there must be others in India who'd want to fix their sleep schedule.

Here's the plan.

1. I hope this is in the correct subreddit.
2. We'll have our own chat room (in reddit) where we'll report in.
3. Everyday we'll set a ""switch off"" time, which will go on reducing day-by-day until the desired time is reached.
4. Let's say today's switch off time is 11:30 PM. At that time, we'll switch off all screens (phone, PC, TV etc.)
5. What to do in the free time? Read a book.

Ready?

My current sleep schedule is 1:30 am to 10 am I think. I wanna wake up at 4 am.",sharanaithal," Hey man just sleep already, maintain a sleep hygiene, meditate, and exhaust your body instead of wasting your time creating chat rooms xD. Try this app ""Sleep by Wysa"", You will get a better idea about how to fix your sleep. lololol What's your blood pressure and cholesterol levels. 

I bet you've got high BP. Instead of the chat room stuff...just note your bp down and get a peaceful sleep, go to bed by 10 and a small morning exercise. You will notice improve on your bp even from the first two days. How's that for some motivation. TIP:

If you want to play this game then as per Ayurveda the best quality of sleep is when you will sleep 9-10 PM, 9 pm to 2 am is the best quality of sleep, Even if you sleep after 2 am to 12 noon, You won't get that quality of sleep or that satisfaction.

That's how our body's bio clock works, Our body works in sync with Nature, we keep on altering it. Try sleeping between 9 to 10 pm, Withing 2-3 weeks you will notice that your sleeping quantity (hours) will decrease by the sleep quality will increase or get better.

Keep your electronics aside 1 hour before your bedtime, Mediate for 15 minutes if you can, Your body will enter Theta state, from that you can easily slip into Delta i.e. Deep Sleep. Don't eat heavy meals at night moreover avoid eating after 7 pm if you can

Follow this much and then I will give you more...

A Chat Room for sleeping?

Ummmm, Lol, Yeah!",2020-02-15 02:36:12
Scheduled,"HR people or people up the ladder, I applied for a role in the trading firm and the yesterday I got a call from them to appear in the interview. But the thing is I am in NCR and the interview is scheduled in Hyderabad. Can I request them to take the interview in their Delhi office?",4,e9z0dj,https://www.reddit.com/r/india/comments/e9z0dj/hr_people_or_people_up_the_ladder_i_applied_for_a/,11,"I have no problem in shifting to Hyderabad if I got the job, but the thing is going to hyderabad would be a bit costly for me in such a short notice with flight tickets costing around 12k for the round trip.

So, would it be bad if I request them to interview me at the Delhi office?

And should I give them a call or keep it on email?

Thanks.

Bit nervous.",_RandomRedditor," Test with API Unless you are in a dire need of job, skip the interview. No Skype or no reimbursement means the company is not specifically looking at you. They are looking for anyone who is cheap and can get the job done. Skip it. No worth in working for a company that does not value you. First step, ask them to have a interview at the Delhi office since you are in Delhi. From the Delhi office they can setup a video-call with the Hyd panel for your interview.

If this doesn't happen - visit Hyd if you are really interested. Since you are traveling for the interview, you can ask for reimbursing the tickets. If they are OK with that, get a written proof (mail from their employee using their official email-id). I have seen cases where they first promise you reimbursement of the tickets, but if you fail in the interview they don't reimburse.",2019-12-13 12:20:22
Scheduled,"Massive mob storms scheduled caste's colony in search of inter-caste couple in Andhra Pradesh, attacks them. An activist alleges that police did not file a case until pressure was mounted from Dalit rights groups.",216,dev3md,https://www.thenewsminute.com/article/massive-mob-storms-sc-colony-search-inter-caste-couple-ap-attacks-them-110125,12,,aiyyooooo," Our society is going back to the rotten eras of caste system. > An inter-caste couple and some of their relatives were allegedly attacked by nearly 200 members related to the woman’s family in Yerpedu mandal of Chittoor district in Andhra Pradesh on Friday night.

> According to a video made by the couple seeking police protection, last week, Mahesh, who belongs to the Mala community (Scheduled Caste), married Sneha, who is from the Yadava community (an OBC community).

> The mob had arrived with sickles, knives, acid bottles and even a hammer, breaking down the door of the room where the couple was staying. However, there were no serious injuries, the police said. Mera desh badal rha hai.

*yep definitely going backwards towards its own downfall.* And this is the reason Sc/St act was needed. Police in india is just another mafia organization. You have to force them, otherwise they have no problem supporting injustice. Nammal nannaavilla Saji Jobless assholes Antha bagundi r/AnormalDayInIndia Dravidanadu rocks!",2019-10-08 12:27:20
Scheduled,Sources: Bangladesh Foreign Minister AK Abdul Momen cancels his visit to India. He was scheduled to visit India from December 12-14.,16,e9lfy6,https://twitter.com/ANI/status/1205051323260948480?s=19,3,,Gavthi_Batman," Bangladesh is literally the only friendly neighbor we have..god forbid they allow China access to their ports. The way our government is spreading hate against Bangladesh, it seems possible Disgusting...Really Pathetic by BJP and Tadipaar Amit Shah to portray Bangladesh, Afghanistan as states that persecute their minorities. No country in world would welcome such remarks. But Our Bhadva Home Minister blatantly accused our neighbors of such wrong doings. 

Now Good luck you fucktards in Government with creating good relationship with our neighbors when China is hounding them one by one. Such a Mess.",2019-12-12 17:27:08
