flair,title,score,id,url,comms_num,body,author,comments,timestamp
Scheduled,What kind of a doctor or treatment do I seek for Sleep Disorder?,13,f3qvfw,https://www.reddit.com/r/india/comments/f3qvfw/what_kind_of_a_doctor_or_treatment_do_i_seek_for/,9,"My sleep timings are 4AM to 11AM. I cannot fall asleep before 4AM and if I force myself up before 11AM it is always with a headache that lasts thought the day.

It began back in 2013 with a night shift job. I did the shift for a year but when I left the company my sleep schedule stayed the same. And now even after 7 years it is the same. Even I am to blame since after I left the job I did not try to fix my sleep times and prolonged it.

Since I am a freelancer now it doesn't affect my work but it is affecting all other aspects of my life. At times if I have to be up early I'm just miserable and cranky the whole day.

What can I do about it? What treatment works or what kind of a doctor should I see?",fbenmart," Try having melatonin pills just an hour before you intend to sleep. If that doesn't works, consult a doctor. Our sleep is dependent on Melatonin. And Melatonin depends on light. In natural conditions (no artificial light), Melatonin starts rising after 19:30/20:00 and peaks in the middle of the night (~ 03:00) and goes down by 07:30/08:00. [Note that the level rises over 7 hours but goes down in 4/5 hours.] As the level starts rising we start feeling sleepy. 

This is a natural cycle, which we can vary but this is something that is deeply encoded within us. We ideally shouldn't mess with this and neither mess by taking Melatonin Pills.

Another factor is the Deep Sleep/Rapid Eye Movement cycles which adapt based on your sleep duration. 

Based on the above factors and disregarding ideal conditions, this is the ideal sleep pattern:
1. The middle of the night (~ 03:00) should coincide with the middle of your sleep. 
2. Your waking time should not vary by more than half an hour, the sleeping time has more flexibility. Changing the waking time messes the Deep Sleep / REM Cycle. 

As an example, taking 6 hours of sleep, 00:00 - 06:00 is the best. For a good, 7/8 hours sleep, 23:00 - 07:00 / 22:30 - 07:00 would be the best. 


Consider the further as a Tl;dr: 

Now coming to your exact problem, if you want to solve your problem in a proper way, you need to have patience and take appropriate steps.

Decide a time you want to sleep and limit light in your environment, 2-3 hours prior with a special focus on screen brightness, filters etc. Then at your decided time, switch off the lights, switch off all screens. (If you aren't feeling sleepy, you can listen to music, even listen to movies/TV Shows/ Audio Books etc. Remember, Light is the priority.) Then no matter when you fall asleep, decide a time and get up at that moment. 

Then, during the day, do not take more than 30-45 minutes nap in the afternoon, fight off the sleep (not by OD'ing on Caffeine). Automatically, you will feel sleepy earlier the next night.

This will cause discomfort for a few days but within a few days (if everything is done right, less than a week) you will have a new sleep cycle. 
Point in favor, People who live for months in a different time zone, get over Jet Lag and get acclimatized in a few days. You cannot change your sleeping patterns overnight. Take baby steps, try sleeping at 3AM first and do that for a couple of weeks, then change it 2 and so on until you reach your desired goal. Make sure you tire yourself throughout the day, exercise, go to the gym, run, do anything than be idle all day. Go to a psychiatrist first. They'll try to find the root cause and refer you accordingly. Supplement glycine and magnesium. Use magnesium in form of magnesium citrate or magnesium glycinate. 

Take 400 mg magnesium daily with dinner and 3-5 gran glycine daily at night. 

Also take a little warm milk with turmeric at night. Meet a doctor from medicine department. 

If required you will be sent to neuro for checkup.",2020-02-14 19:25:11
Scheduled,Ayodhya hearing scheduled for 29 January cancelled due to unavailability of Justice SA Bobde,4,akbqcv,http://www.jantakareporter.com/india/ayodhya-hearing-scheduled-for-29-january-cancelled-due-to-unavailability-of-justice-sa-bobde/229334/?fbclid=IwAR1rR8_PT5fZIk1oYQOo7w5FZ2vxDAYRl0NoH7rJ5Vc5Av0gog3lkiF0lp8,0,,MODI-HATER,,2019-01-27 20:46:53
Scheduled,Biweekly video games thread. 20/02/2017 [Scheduled],22,5v2qsu,https://www.reddit.com/r/india/comments/5v2qsu/biweekly_video_games_thread_20022017_scheduled/,158,"Let us use this thread to discuss games that we have been playing (old or new, any platform, AAA or indie). What game are you looking forward to? Have you recently upgraded/bought a rig? Show off your specs (or better yet, screenshot of the sweet sweet graphics). Are you a dev? Show us your wares.

Please don't just list the names of games as your entire post, make sure to write a word or two about the games. Writing the names of the games in **bold** is nice, to make it easier for people skimming the thread to pick out the names.

*****

[All scheduled threads.](https://sd.reddit.com/r/india/search?q=flair%3AScheduled+-title%3ARandom&restrict_sr=on&sort=new&t=all/#sd)",axaytsg," Crushed my friend in AoE 2. The satisfaction was priceless. Everything went right.

Also, /r/CrackWatch is on a roll. Played some  really different games. Playing **Life is Strange**

Completed Episode 4. The game affects me like no other game. Its too close to life. And way too tough for players to make decisions. playing **Uncharted 3**. Almost at the end i guess.

**Bioshock** is next in line. Finished **Alien: Isolation**. Best survival horror since Dead Space. 10/10 for the sheer terror factor. I got it for cheap (Rs. 160) from steam. Civ V.

Quit the map* after getting nuked by Elizabeth while fending off Gandhi at the same time.

Might start a new game of Civ this friday. Play as Genghis fucking khan and show them who's their daddy.  My Witcher 3 addiction shows no sign of stopping. 

Also playing Resident Evil 7, and bought the 1999 game Urban Chaos yesterday from the Square Enix sale. I remember playing this game for hours.  Started Witcher 3 again. I recently gave up on Overwatch due to reasons so just trying to fill the void by playing one of my favorite games of all time.  Played **Crusader Kings 2**. Lost chance to become Emperor of Deccan. Fuck Rashtrakutas.     Looking for some people to play DotA 2 with. Current MMR fluctuating around 3.9k. Looking for some fun games in the SEA server. Un-installed steam and some 200 gb worth of games today. I have been addicted to gaming since ages i think its time to move on! Started playing **Fallout: New Vegas** last weekend. Since there is a lot of travel, I am playing it pretty slow and trying to complete quests in an area before proceeding further.

**FIFA 17** and **Stardew Valley** as gap-fillers. Playing **Alto's Adventure** on android. Loving it so far. [deleted] Playing **Rocket League** these days. It's a pretty fun game. I like to play online but I get such bad ping. Most of the times it's between 150-200 and that's playable I suppose. I am invoker Started playing **Doom (2016)**. The download size seemed daunting at first but two nights of jio unlimited nighttime later I'm ripping and tearing my way through Mars.  Definitely lives up to the hype, it's refreshing to see somewhat complex map design again in singleplayer fpses. It's also amazing how decent it runs on my toaster of a laptop. The difficulty is somewhat on the easy side on the default difficulty but I don't want to wade into a higher difficulty without one vanilla playthrough and seeing what the different enemy types and weapons are. 

Also dipped into **battlefield 1**(singleplayer campaign only because *coughcough*) . The series had never interested me (my internet speeds had always been too shit for multiplayer) but the ww1 setting sure piqued my interest. The campaign is way too short but it's interesting to see far cry style stealth-through-bases gameplay (albeit too simplified) instead of missions where you can't even go ten steps away from the scripted path. The Lawrence of Arabia campaign was an aesthetic I longed to see in videogames for an eternity and it was decent enough(some real mgs tpp vibes). After hearing so much about it, I've begun playing **Kerbal Space Program**. 

It's...a lot more complicated than I thought it'd be. I'm also glad I'm not in charge of the ISRO. 

RIP little Jebediah, who died because I didn't understand the staging process, which resulted in your little parachute being incinerated by the boosters.  [Pretty badass](https://www.youtube.com/watch?v=vTRppi351O0) sounding trailer for an indie-game in development by a Bangalore team

 [deleted] [deleted] Playing **FarCry 4** and **Rocket League** with occasional **Dota 2**. FarCry is pretty fun but it's too long for my comfort. Also, dying to play **Overwatch** but no moniez saar :'(. Playing **Mario Maker** on CEMU (v 1.7.1) works pretty great at stable 60 fps on my PC at least. Will try **Bayonetta 2** on Cemu when v1.7.2 is released. Anyone played for honor yet?  What's the server status like for you?  Finished Dying Light. Planning to get dark souls 3 Playing gta 5, bought it recently and don't have any friends so doing moding offline and btw if someone interested and can play with me online personal sessions, i would love to be friends. But i should warn you im pretty new :) maybe will try making YouTube videos. Playing counter strike 1.6. Mostly on weekends. Does anyone here play? I play mostly on igc servers Bought HITMAN^TM , spent 8 hours on the two prologue levels. I need to get myself up and try finish The Witcher 3 and Life is Strange. Playing Overwatch , reached diamond from Bronze this season, I WILL be a top 500 player next season, I Need be a top 500 player next season, 

Currently watching Surefour and practicing edge positioning. Bought a new ps4 pro and tried bloodborne. Fucking difficult game  Playing Resident Evil 7, WWE2K17, and have some Visual Novels on hold. Got the humble freedom bundle. Playing random things from there. So many cool games! **Invisible Inc**, **Sproggiwood**, and **2064: Read only memories**. I'll be checking out the other games over the next few weeks. I am currently playing Far Cry 3 in warrior mode... Thats my hobby, play games in most difficult mode. Anyone sharing same interest?? I recently discovered a cool indie game called Foxhole on steam. It's gor a persistent war going on and manages to simulate war-time logistics quite well.  Just ended Rise of the Tomb Raider!
 Got really addicted to **Warframe**. This game is seriously amazing. Currently Mastery rank 7. Looking for some friends, ign- HuntingLion (yeah I really like the name :P ) Anyone playing **Paladins**? I'm 350 hrs into the game. It's pretty fun f2p. Playing **For Honor**. It's nice, when it works. buy it if you like fighting games. 1v1 and 2v2 are the best modes. Dont bother with 4v4 I'm quite shameless to admit that I only play Overwatch, though looking forward to Mass Effect Andromeda. Also have to play Dishonored 2, as the 1st was really fucking good. Installed bunch of Indie games and played few of them and sadly i stopped playing all of them in 4 hrs. 

Started with **Monaco** and after few mins i started to hate those colours. Made me dizzy. Uninstalled. 

Next up **Metal Slug 3** was playing the last mission and i had power cut. Saves gone :(. Uninstalled.

Next one **Insanely Twisted Shadow Planet**. Loved it initially. Then encountered boss fights. Defeated one and then encountered another boss. Failed 8 times. Raged quit. Uninstalled.

Last one **The Swapper**. Loved it initially. I then realized iam not smart enough for puzzles games and i hate puzzles and platformers games. Uninstalled. 
 Got Rise of Tomp Raider for Rs 400. Gifted one for an old friend too. Felt good.

Also got Humble Bundle Freedom. Crafted a shitload of badges on steam lol. It was something like 50 games. Darksouls 3 and the new Hitman. Civilization V has destroyed me whole weekend halfway through **COD Black Ops 3** campaign. Can't wait to join multiplayer and get absolutely butchered to pieces. 

Also, anyone interested in a lengthy destiny raid this weekend? I have a mic and don't play annoying music. PSN: toothpaste4dinnr",2017-02-20 13:06:01
Scheduled,"No, People who will be eliminated by the CAA NRC PROCESS won't get citizenship in 11 years",181,eivymz,https://www.reddit.com/r/india/comments/eivymz/no_people_who_will_be_eliminated_by_the_caa_nrc/,19,"A common misconception that I am seeing making rounds is that they will get citizenship in 11 years.

No, that's a fraud being peddled by IT CELL


Don't fall for it

The citizenship act clearly denies ILLEGAL MIGRANTS from getting it by registration or normalization.

And guess what these people eliminated are being termed? ILLEGAL MIGRANTS.

Do we have any deportation clause with any country? NO

Will we provide them REFUGEE STATUS? Lol, our refugee acceptance is a slimy 10%. Lets not joke ourselves, there are ""Hindu"" Tamil migrants who came here during civil war who are still fighting for citizenship.

SO PLEASE. LET GOOD SENSE PREVAIL. THE ILLEGAL MIGRANTS WILL BECOME STATELESS PEOPLE WITHOUT FRANCHISE AND FUNDAMENTAL RIGHTS.

Those who don't trust my legal knowledge, check this kindly

https://indiancitizenshiponline.nic.in/acquisition1.htm

Naturalisation (Section 6)

Citizenship of India by naturalization can be acquired by a foreigner (not illegal migrant) who is ordinarily resident in India for TWELVE YEARS (throughout the period of twelve months immediately preceding the date of application and for ELEVEN YEARS in the aggregate in the FOURTEEN YEARS preceding the twelve months) and other qualifications as specified in Third Schedule to the Act. Application shall be made in Form-XII.",entirepolscience," Best explanation of CAA-NRC I have seen. 

https://www.youtube.com/watch?v=JTJVQFymMkM To be naturalised you need to be a foreigner holding valid travel documents and residency permits. The unclear status of those excluded from Assam NRC is an indicator of the widespread chaos that would follow a nation wide exercise. Even if we accept that they'll get citizenship in 11 years, where do bhakts think they'll be house?

In concentration camps.

For 11 fucking years. It's called citizenship by naturalization. If any foreigner is a citizen of India for 11 years and one year after application then he will be considered Indian citizen. This duration was changed to 5 years for Hindu, Christians, Sikh etc of countries from Bangladesh, Pakistan and Afghanistan in the current CAA 2019

It's not a fraud or anything. It's in original Citizenship rule. You can read about it here: https://en.m.wikipedia.org/wiki/Indian_nationality_law",2020-01-02 17:07:22
Scheduled,"When they say ""scheduled Interview"" and then it becomes TechFest",21,8uzadz,https://i.redd.it/pw1y6lk8b2711.jpg,5,,rohan27nabar89, Did they light the inaugural diya though?   [deleted] Better than interviews where they like you so much that they make you sit the whole day. Hi Rohan,2018-06-30 12:02:21
Scheduled,r/India Pets and Animals thread,52,dvn1le,https://www.reddit.com/r/india/comments/dvn1le/rindia_pets_and_animals_thread/,57,"Since there has been a lot of interest, we want to have scheduled threads for you to post images of your doggos, puppers and kitties. Other animals are welcome too, including cute images of our animal bros that you clicked outside. Feel free to discuss any pet problems and share your pet stories in this thread.

Please note that only OC content is allowed here. We will have these threads every month.",rorschach34," Lickopottamus

https://imgur.com/a/Reb3qga [A cat at my friend's IT Park](https://streamable.com/hiit6). He waits for us at the exact spot every morning for food. I just lost my 6 month old kitten yesterday. He was found run over by a car inside the parking lot of the apartment. He was an outdoor cat.

I request fellow redditors to look under your car before you start and drive as slow as possible inside apartment premises atleast taking care not to run over anything. [Simba](https://imgur.com/gallery/IssI35J)  He’ll turn 1 in 15days. :D Any suggestions for Wheat free or Gluten Free biscuits for dogs? The pets like the Naughty Pet biscuits which we get for them. Looking for other options. What can one do against a missing stray dog, like FIR or something? A bit of context below as there is reason to suspect the missing on neighbours. 

Used to feed the dog now and then. Took her to doc when her health was really bad recently. Neighbour's kid seems to have been attacked by some dogs and he is blaming the stray one we used to feed. Now she has been missing since past 24 hours. https://vimeo.com/372841145

Little Bruno - our 5 months old....first trying to figure out who is barking, then confronting the anonymous threat followed by getting scared and lastly realizing that mom's is always there. Nellie (cat, 4F) & her daughter Pishu (also cat, 3F):

[https://imgur.com/yj9l7E0](https://imgur.com/yj9l7E0) So I plan to have a pet cat some time in the future. How much work is having one as a pet? Does it require attention all the time? Is it possible to have a cat while having a full time job? Why aren't fishes considered cute pets :( Can i post a pic of my snake? Do cats need to be given any vacancies/shots ? I would really like to have a pet and care for it. Dogs and cats are not an option for me. Don't want to cage a bird either. Is there any pet I can get that doesn't need constant attention or feel isolated when alone? I live alone if that matters. Thank you so much! Finally free of the random posts.",2019-11-13 13:29:46
Scheduled,Fight #COVID19,4,fndf09,https://www.reddit.com/r/india/comments/fndf09/fight_covid19/,1,"Inviting developers around the world to build something awesome and helpful. HackCovid19 is online 30 hours hackathon on 25-26 March  

Hello folks! Is the quarantine getting to you? Too much time on your hands with no productive outcome? 

HackCOVID19 is a 30-hour online hackathon where you have the opportunity to build something unique and suitable to help curb the current world crisis and help humanity as a whole. This is the time to prove your mettle and show that nerds can help and impact the world with only a laptop and caffeine at their disposal. 

DSC SVNIT invites y'all to participate in our nationwide event to bring forth some much-needed change! Here's calling all the quarantined coders to work their spells from their homes! 

Here's a little motivation for you to gear up for the hackathon. Participate and stand a chance to win the following: 

• Matic cash prize of ₹15k if the idea is built upon Matic 

• Matic cash prize of ₹10k if built upon Ethereum 

• Devfolio swags and t-shirts 

• DSC swags and premium T-shirts

&#x200B;

Event schedule: Wednesday 25th March 8:00 AM to Thursday 26th March 2:00 PM

Register here:-

[https://hackcovid19.devfolio.co/](https://hackcovid19.devfolio.co/)

For more information, we recommend going through the HackCovid19 document thoroughly.

[Hack the COVID19](https://preview.redd.it/8wejoc4ngco41.jpg?width=1280&format=pjpg&auto=webp&s=5a918b01109941fc297e932c4636e46f27ccf859)",dubesar,,2020-03-23 11:49:08
